Title,Image,Subtitle,Trend,Color,,,,,,
Aggiornamento,https://github.com/Paulsword/PilloleOttimismo/raw/main/Cover0.jpg,9 settembre 2021,,1,,,,,,
Incidenza,https://github.com/Paulsword/PilloleOttimismo/raw/main/Cover1.jpg,63.6,"L'INCIDENZA su base nazionale è al momento pari a 63.6 nuovi positivi ogni 100.000 abitanti in 7 giorni (ieri era 65.7). Le Regioni con i valori più elevati sono Sicilia, con 148.7 casi, Calabria (92.1), Bolzano (91.4), e Toscana (84.3). L'incidenza più bassa è in Valle d'Aosta, con 20.2 casi.",2,,,,,,
Variazione,https://github.com/Paulsword/PilloleOttimismo/raw/main/Cover2.jpg,-13.6%,"La VARIAZIONE PERCENTUALE dei nuovi casi negli ultimi sette giorni, rispetto ai sette precedenti, è stata pari a -13.6% (ieri era -11.7%, il giorno prima -12.5%, prima ancora -11.9%, -9.7%, -8.2%, -8%). I valori più elevati tra le Regioni si riscontrano in Bolzano (+28.1% negli ultimi sette giorni rispetto ai sette precedenti), Valle d'Aosta (+19%), Piemonte (+3%), Trento (+0.4%), Friuli VG (-0.1%), Lombardia (-4.3%), Lazio (-4.4%), Umbria (-8.4%), Marche (-9.3%).",3,,,,,,
Nuovi casi,https://github.com/Paulsword/PilloleOttimismo/raw/main/Cover3.jpg,5522,"Sono 5522 i nuovi positivi registrati oggi, su 291468 tamponi (1.9%) e 60535 persone testate (9.12%).
Negli ultimi sette giorni abbiamo avuto in media 5387 nuovi positivi al giorno, ossia -845 casi al giorno rispetto ai sette giorni precedenti (ieri era -736).",4,,,,,,
Ricoveri,https://github.com/Paulsword/PilloleOttimismo/raw/main/Cover6.jpg,-5,"Abbiamo attualmente 4230 pazienti RICOVERATI IN REPARTO, pari al 7.3% dei posti letto disponibili (fonte: AGENAS). Negli ultimi 7 giorni la variazione media del numero di pazienti ricoverati è stata pari a +4 pazienti al giorno (era +21 nei sette giorni precedenti). La variazione percentuale complessiva sul totale dei pazienti ricoverati in questi sette giorni è stata +0.6%",5,,,,,,
TI,https://github.com/Paulsword/PilloleOttimismo/raw/main/Cover5.jpg,-6,"Oggi in TERAPIA INTENSIVA saldo di -6 pazienti (38 ingressi e 44 uscite). La variazione del totale degli INGRESSI in TI negli ultimi sette giorni, rispetto ai sette giorni precedenti, è stata del -11.4% (ieri era -4.6%, il giorno prima -2%).
I pazienti in TI sono complessivamente 558, pari al 6.1% dei posti letto attualmente disponibili. Negli ultimi sette giorni la variazione percentuale complessiva è stata +0.5%",6,,,,,,
Decessi,https://github.com/Paulsword/PilloleOttimismo/raw/main/Cover7.jpg,59,"In media abbiamo registrato in Italia 59 DECESSI al giorno negli ultimi sette giorni, e 56 nei sette giorni precedenti. La variazione dei decessi in questi ultimi sette giorni, rispetto ai sette precedenti, è stata pari a +4.8% (ieri era +10.9%, il giorno prima +13.9%, prima ancora +19.9%, +23.4%, +25%, +27.9%). Si ricordi tuttavia che molti decessi registrati risalgono alle settimane o ai mesi precedenti.",7,,,,,,
Vaccini,https://github.com/Paulsword/PilloleOttimismo/raw/main/Cover8.jpg,257 353,"Il 8/9/2021 sono state 257 353 le somministrazioni di vaccino. Ad oggi in Italia abbiamo eseguito 80 013 442 dosi. Il 73.38% della popolazione ha ricevuto almeno una dose, e il 66.3% della popolazione ha ricevuto vaccinazione completa.",8,,,,,,
