Title,Image,Subtitle,Trend,Color,,,,,,
Aggiornamento,https://github.com/Paulsword/PilloleOttimismo/raw/main/Cover0.jpg,12 aprile 2021,,1,,,,,,
Incidenza,https://github.com/Paulsword/PilloleOttimismo/raw/main/Cover1.jpg,169,"L'INCIDENZA su base nazionale è al momento pari a 169 nuovi positivi ogni 100.000 abitanti in 7 giorni. Le Regioni con i valori più elevati sono Valle d'Aosta, con 293 casi, seguono Puglia (240), Piemonte (210), e Campania (204). L'incidenza più bassa è in Molise, con 64 casi.
Nei grafici trovate i valori di incidenza dei Paesi d'Europa, calcolati su 14 giorni.",2,,,,,,
Variazione,https://github.com/Paulsword/PilloleOttimismo/raw/main/Cover2.jpg,-24.9%,"La VARIAZIONE PERCENTUALE dei nuovi casi negli ultimi sette giorni, rispetto ai sette precedenti, è stata pari a -24.9% (ieri era -25.5%, il giorno prima -24.6%, prima ancora -23.4%, -22.4%, -18%, -11.1%). I valori più elevati tra le Regioni si riscontrano in Basilicata (+20.2% negli ultimi sette giorni rispetto ai sette precedenti), Sicilia (+12.9%), Calabria (+0.6%), Molise (-5%), Sardegna (-8.7%), Campania (-10.6%), Umbria (-11.7%), Abruzzo (-19.8%), Lazio (-23.2%).",3,,,,,,
Nuovi casi,https://github.com/Paulsword/PilloleOttimismo/raw/main/Cover3.jpg,9789,"Sono 9789 i nuovi positivi registrati oggi, su 190635 tamponi (5.1%) e 50091 persone testate (19.54%).
Negli ultimi sette giorni abbiamo avuto in media 14379 nuovi positivi al giorno, ossia -4756 casi al giorno rispetto ai sette giorni precedenti (ieri era -4954).",4,,,,,,
Ricoveri,https://github.com/Paulsword/PilloleOttimismo/raw/main/Cover6.jpg,+78,"Abbiamo attualmente 27329 pazienti RICOVERATI IN REPARTO, pari al 41% dei posti letto disponibili (fonte: AGENAS). Negli ultimi 7 giorni la variazione media del numero di pazienti ricoverati è stata pari a -208 pazienti al giorno (era -54 nei sette giorni precedenti). La variazione percentuale complessiva sul totale dei pazienti ricoverati in questi sette giorni è stata -5.1%",5,,,,,,
TI,https://github.com/Paulsword/PilloleOttimismo/raw/main/Cover5.jpg,+8,"Oggi in TERAPIA INTENSIVA saldo di +8 pazienti (167 ingressi e 159 uscite). La variazione del totale degli INGRESSI in TI negli ultimi sette giorni, rispetto ai sette giorni precedenti, è stata del -10.5% (ieri era -9%, il giorno prima -9%).
I pazienti in TI sono complessivamente 3593, pari al 39% dei posti letto attualmente disponibili. Negli ultimi sette giorni la variazione percentuale complessiva è stata -3.9%",6,,,,,,
Decessi,https://github.com/Paulsword/PilloleOttimismo/raw/main/Cover7.jpg,358,"In media abbiamo avuto in Italia 434 DECESSI al giorno negli ultimi sette giorni, e 428 nei sette giorni precedenti. La variazione dei decessi in questi ultimi sette giorni, rispetto ai sette precedenti, è stata pari a +1.4% (ieri era -4.4%, il giorno prima -3.6%, prima ancora -2.6%, -1.1%, +0.7%, -4.4%).",7,,,,,,
Vaccini,https://github.com/Paulsword/PilloleOttimismo/raw/main/Cover8.jpg,13286783,"Ad oggi in Italia abbiamo eseguito 13286783 dosi di vaccino. 9297400 persone, pari al 15.59% della popolazione, hanno ricevuto la prima dose, e 3989383 persone, pari al 6.69% della popolazione, hanno ricevuto anche la seconda dose.",8,,,,,,
Zone rosse,https://github.com/Paulsword/PilloleOttimismo/raw/main/Cover9.jpg,21,"Delle attuali 21 Province in fascia rossa, 15 (pari a 11429056 persone) hanno un'incidenza al di sotto dei 250 casi settimanali ogni 100.000 abitanti. Qui proponiamo un modello su base provinciale e con soglia di incidenza rigorosamente correlata alla ricettività ospedaliera. Al momento, 48 Province al di sotto di quella soglia sono in regime di restrizione, e 5 di queste sono in fascia rossa.  Viceversa, 43 Province che secondo il nostro modello sono sopra-soglia, si trovano invece in arancione.",9,,,,,,
