Title,Image,Subtitle,Trend,Color,,,,,,
Aggiornamento,https://github.com/Paulsword/PilloleOttimismo/raw/main/Cover0.jpg,30 giugno 2021,,1,,,,,,
Incidenza,https://github.com/Paulsword/PilloleOttimismo/raw/main/Cover1.jpg,8.7,"L'INCIDENZA su base nazionale è al momento pari a 8.7 nuovi positivi ogni 100.000 abitanti in 7 giorni. Le Regioni con i valori più elevati sono Basilicata, con 16.8 casi, seguono Sicilia (15.1), Abruzzo (13.5), e Campania (12.3). L'incidenza più bassa è in Liguria, con 4 casi.
Nei grafici trovate i valori di incidenza dei Paesi d'Europa, calcolati su 14 giorni.",2,,,,,,
Variazione,https://github.com/Paulsword/PilloleOttimismo/raw/main/Cover2.jpg,-24.6%,"La VARIAZIONE PERCENTUALE dei nuovi casi negli ultimi sette giorni, rispetto ai sette precedenti, è stata pari a -24.6% (ieri era -26.8%, il giorno prima -28.9%, prima ancora -31.2%, -34.3%, -34.1%, -35.2%). I valori più elevati tra le Regioni si riscontrano in Sardegna (+47.5% negli ultimi sette giorni rispetto ai sette precedenti), Abruzzo (+32.1%), Valle d'Aosta (+7.1%), Friuli VG (+6.4%), Campania (+0.3%), Molise (-10.5%), Toscana (-20.3%), Lombardia (-21.5%), Emilia Romagna (-22.8%).",3,,,,,,
Nuovi casi,https://github.com/Paulsword/PilloleOttimismo/raw/main/Cover3.jpg,776,"Sono 776 i nuovi positivi registrati oggi, su 185016 tamponi (0.4%) e 43948 persone testate (1.77%).
Negli ultimi sette giorni abbiamo avuto in media 734 nuovi positivi al giorno, ossia -239 casi al giorno rispetto ai sette giorni precedenti (ieri era -278).",4,,,,,,
Ricoveri,https://github.com/Paulsword/PilloleOttimismo/raw/main/Cover6.jpg,-83,"Abbiamo attualmente 1593 pazienti RICOVERATI IN REPARTO, pari al 3% dei posti letto disponibili (fonte: AGENAS). Negli ultimi 7 giorni la variazione media del numero di pazienti ricoverati è stata pari a -78 pazienti al giorno (era -132 nei sette giorni precedenti). La variazione percentuale complessiva sul totale dei pazienti ricoverati in questi sette giorni è stata -25.6%",5,,,,,,
TI,https://github.com/Paulsword/PilloleOttimismo/raw/main/Cover5.jpg,-23,"Oggi in TERAPIA INTENSIVA saldo di -23 pazienti (4 ingressi e 27 uscite). La variazione del totale degli INGRESSI in TI negli ultimi sette giorni, rispetto ai sette giorni precedenti, è stata del -19.7% (ieri era -25%, il giorno prima -37%).
I pazienti in TI sono complessivamente 247, pari al 3% dei posti letto attualmente disponibili. Negli ultimi sette giorni la variazione percentuale complessiva è stata -28.2%",6,,,,,,
Decessi,https://github.com/Paulsword/PilloleOttimismo/raw/main/Cover7.jpg,24,"In media abbiamo avuto in Italia 33 DECESSI al giorno negli ultimi sette giorni, e 26 nei sette giorni precedenti. La variazione dei decessi in questi ultimi sette giorni, rispetto ai sette precedenti, è stata pari a +27.5% (ieri era -0.5%, il giorno prima -17.4%, prima ancora -24.6%, -26%, -35.9%, -48.7%).",7,,,,,,
Vaccini,https://github.com/Paulsword/PilloleOttimismo/raw/main/Cover8.jpg,542 952,"Il 29/6/2021 sono state 542 952 le somministrazioni di vaccino. Ad oggi in Italia abbiamo eseguito 51 373 182 dosi. Il 57.33% della popolazione ha ricevuto almeno una dose, e il 31.44% della popolazione ha ricevuto vaccinazione completa.",8,,,,,,
