Title,Image,Subtitle,Trend,Color,,,,,,
Aggiornamento,https://github.com/Paulsword/PilloleOttimismo/raw/main/Cover0.jpg,2 giugno 2021,,1,,,,,,
Incidenza,https://github.com/Paulsword/PilloleOttimismo/raw/main/Cover1.jpg,36,"L'INCIDENZA su base nazionale è al momento pari a 36 nuovi positivi ogni 100.000 abitanti in 7 giorni. Le Regioni con i valori più elevati sono Valle d'Aosta, con 61 casi, seguono Sicilia (50), Campania (49), e Bolzano (49). L'incidenza più bassa è in Molise, con 12 casi.
Nei grafici trovate i valori di incidenza dei Paesi d'Europa, calcolati su 14 giorni.",2,,,,,,
Variazione,https://github.com/Paulsword/PilloleOttimismo/raw/main/Cover2.jpg,-27%,"La VARIAZIONE PERCENTUALE dei nuovi casi negli ultimi sette giorni, rispetto ai sette precedenti, è stata pari a -27% (ieri era -27.4%, il giorno prima -27.9%, prima ancora -28%, -28.6%, -28.6%, -29.1%). I valori più elevati tra le Regioni si riscontrano in Molise (+9.4% negli ultimi sette giorni rispetto ai sette precedenti), Friuli VG (+5.1%), Sardegna (-0.9%), Sicilia (-9.1%), Trento (-9.9%), Umbria (-12.8%), Bolzano (-14.5%), Veneto (-25.2%), Lombardia (-25.3%).",3,,,,,,
Nuovi casi,https://github.com/Paulsword/PilloleOttimismo/raw/main/Cover3.jpg,2897,"Sono 2897 i nuovi positivi registrati oggi, su 226272 tamponi (1.3%) e 65900 persone testate (4.4%).
Negli ultimi sette giorni abbiamo avuto in media 3054 nuovi positivi al giorno, ossia -1132 casi al giorno rispetto ai sette giorni precedenti (ieri era -1208).",4,,,,,,
Ricoveri,https://github.com/Paulsword/PilloleOttimismo/raw/main/Cover6.jpg,-334,"Abbiamo attualmente 5858 pazienti RICOVERATI IN REPARTO, pari al 10% dei posti letto disponibili (fonte: AGENAS). Negli ultimi 7 giorni la variazione media del numero di pazienti ricoverati è stata pari a -323 pazienti al giorno (era -414 nei sette giorni precedenti). La variazione percentuale complessiva sul totale dei pazienti ricoverati in questi sette giorni è stata -27.8%",5,,,,,,
TI,https://github.com/Paulsword/PilloleOttimismo/raw/main/Cover5.jpg,-56,"Oggi in TERAPIA INTENSIVA saldo di -56 pazienti (33 ingressi e 89 uscite). La variazione del totale degli INGRESSI in TI negli ultimi sette giorni, rispetto ai sette giorni precedenti, è stata del -32.3% (ieri era -36.1%, il giorno prima -40.8%).
I pazienti in TI sono complessivamente 933, pari al 11% dei posti letto attualmente disponibili. Negli ultimi sette giorni la variazione percentuale complessiva è stata -27%",6,,,,,,
Decessi,https://github.com/Paulsword/PilloleOttimismo/raw/main/Cover7.jpg,62,"In media abbiamo avuto in Italia 94 DECESSI al giorno negli ultimi sette giorni, e 139 nei sette giorni precedenti. La variazione dei decessi in questi ultimi sette giorni, rispetto ai sette precedenti, è stata pari a -32.3% (ieri era -28.3%, il giorno prima -23.7%, prima ancora -23.2%, -22.1%, -19.1%, -7.7%).",7,,,,,,
Vaccini,https://github.com/Paulsword/PilloleOttimismo/raw/main/Cover8.jpg,453 424,"Il 1/6/2021 sono state 453 424 le somministrazioni di vaccino. Ad oggi in Italia abbiamo eseguito 35 705 244 dosi. Il 40.62% della popolazione ha ricevuto almeno una dose, e il 20.88% della popolazione ha ricevuto vaccinazione completa.",8,,,,,,
