Title,Image,Subtitle,Trend,Color,,,,,,
Aggiornamento,https://github.com/Paulsword/PilloleOttimismo/raw/main/Cover0.jpg,5 luglio 2021,,1,,,,,,
Incidenza,https://github.com/Paulsword/PilloleOttimismo/raw/main/Cover1.jpg,9,"L'INCIDENZA su base nazionale è al momento pari a 9 nuovi positivi ogni 100.000 abitanti in 7 giorni. Le Regioni con i valori più elevati sono Sicilia, con 16.3 casi, seguono Abruzzo (15.1), Campania (13.4), e Marche (11.6). L'incidenza più bassa è in Molise, con 2.4 casi.
Nei grafici trovate i valori di incidenza dei Paesi d'Europa, calcolati su 14 giorni.",2,,,,,,
Variazione,https://github.com/Paulsword/PilloleOttimismo/raw/main/Cover2.jpg,-2.2%,"La VARIAZIONE PERCENTUALE dei nuovi casi negli ultimi sette giorni, rispetto ai sette precedenti, è stata pari a -2.2% (ieri era -5.7%, il giorno prima -7.7%, prima ancora -14.8%, -20.6%, -24.6%, -26.8%). I valori più elevati tra le Regioni si riscontrano in Marche (+123.1% negli ultimi sette giorni rispetto ai sette precedenti), Liguria (+44.4%), Abruzzo (+38.6%), Trento (+23.1%), Bolzano (+17.6%), Sardegna (+17.4%), Veneto (+15.8%), Campania (+14.5%), Sicilia (+0.5%).",3,,,,,,
Nuovi casi,https://github.com/Paulsword/PilloleOttimismo/raw/main/Cover3.jpg,480,"Sono 480 i nuovi positivi registrati oggi, su 74649 tamponi (0.6%) e 22430 persone testate (2.14%).
Negli ultimi sette giorni abbiamo avuto in media 763 nuovi positivi al giorno, ossia -17 casi al giorno rispetto ai sette giorni precedenti (ieri era -46).",4,,,,,,
Ricoveri,https://github.com/Paulsword/PilloleOttimismo/raw/main/Cover6.jpg,-27,"Abbiamo attualmente 1337 pazienti RICOVERATI IN REPARTO, pari al 2.4% dei posti letto disponibili (fonte: AGENAS). Negli ultimi 7 giorni la variazione media del numero di pazienti ricoverati è stata pari a -55 pazienti al giorno (era -95 nei sette giorni precedenti). La variazione percentuale complessiva sul totale dei pazienti ricoverati in questi sette giorni è stata -22.4%",5,,,,,,
TI,https://github.com/Paulsword/PilloleOttimismo/raw/main/Cover5.jpg,-6,"Oggi in TERAPIA INTENSIVA saldo di -6 pazienti (2 ingressi e 8 uscite). La variazione del totale degli INGRESSI in TI negli ultimi sette giorni, rispetto ai sette giorni precedenti, è stata del -41.4% (ieri era -40.3%, il giorno prima -37.5%).
I pazienti in TI sono complessivamente 191, pari al 2.3% dei posti letto attualmente disponibili. Negli ultimi sette giorni la variazione percentuale complessiva è stata -33.9%",6,,,,,,
Decessi,https://github.com/Paulsword/PilloleOttimismo/raw/main/Cover7.jpg,31,"In media abbiamo avuto in Italia 26 DECESSI al giorno negli ultimi sette giorni, e 30 nei sette giorni precedenti. La variazione dei decessi in questi ultimi sette giorni, rispetto ai sette precedenti, è stata pari a -13.9% (ieri era -12.4%, il giorno prima -12.7%, prima ancora +2.1%, +30.8%, +27.5%, -0.5%).",7,,,,,,
Vaccini,https://github.com/Paulsword/PilloleOttimismo/raw/main/Cover8.jpg,405 105,"Il 4/7/2021 sono state 405 105 le somministrazioni di vaccino. Ad oggi in Italia abbiamo eseguito 54 371 521 dosi. Il 59.31% della popolazione ha ricevuto almeno una dose, e il 35.78% della popolazione ha ricevuto vaccinazione completa.",8,,,,,,
