Title,Image,Subtitle,Trend,Color,,,,,,
Aggiornamento,https://github.com/Paulsword/PilloleOttimismo/raw/main/Cover0.jpg,31 marzo 2021,,1,,,,,,
Incidenza,https://github.com/Paulsword/PilloleOttimismo/raw/main/Cover1.jpg,242,"L'INCIDENZA su base nazionale è al momento pari a 242 nuovi positivi ogni 100.000 abitanti in 7 giorni. Le Regioni con i valori più elevati sono Valle d'Aosta, con 434 casi, seguono Friuli VG (342), Piemonte (337), e Puglia (310). L'incidenza più bassa è in Molise, con 72 casi.
Nei grafici trovate i valori di incidenza dei Paesi d'Europa, calcolati su 14 giorni.",2,,,,,,
Variazione,https://github.com/Paulsword/PilloleOttimismo/raw/main/Cover2.jpg,-2.9%,"La VARIAZIONE PERCENTUALE dei nuovi casi negli ultimi sette giorni, rispetto ai sette precedenti, è stata pari a -2.9% (ieri era -5.8%, il giorno prima -5.1%, prima ancora -5.4%, -5.7%, -7.2%, -6.6%). I valori più elevati tra le Regioni si riscontrano in Sardegna (+76.2% negli ultimi sette giorni rispetto ai sette precedenti), Valle d'Aosta (+59.2%), Sicilia (+38.1%), Liguria (+16.8%), Calabria (+7.6%), Puglia (+5.6%), Toscana (+5.2%), Umbria (+3.9%), Basilicata (+3.7%).",3,,,,,,
Nuovi casi,https://github.com/Paulsword/PilloleOttimismo/raw/main/Cover3.jpg,23904,"Sono 23904 i nuovi positivi registrati oggi, su 351221 tamponi (6.8%) e 100994 persone testate (23.67%).
Negli ultimi sette giorni abbiamo avuto in media 20579 nuovi positivi al giorno, ossia -622 casi al giorno rispetto ai sette giorni precedenti (ieri era -1254).",4,,,,,,
Ricoveri,https://github.com/Paulsword/PilloleOttimismo/raw/main/Cover6.jpg,-51,"Abbiamo attualmente 29180 pazienti RICOVERATI IN REPARTO, pari al 44% dei posti letto disponibili (fonte: AGENAS). Negli ultimi 7 giorni la variazione media del numero di pazienti ricoverati è stata pari a +106 pazienti al giorno (era +274 nei sette giorni precedenti). La variazione percentuale complessiva sul totale dei pazienti ricoverati in questi sette giorni è stata +2.6%",5,,,,,,
TI,https://github.com/Paulsword/PilloleOttimismo/raw/main/Cover5.jpg,-6,"Oggi in TERAPIA INTENSIVA saldo di -6 pazienti (283 ingressi e 289 uscite). La variazione del totale degli INGRESSI in TI negli ultimi sette giorni, rispetto ai sette giorni precedenti, è stata del -2.2% (ieri era -2.5%, il giorno prima 0%).
I pazienti in TI sono complessivamente 3710, pari al 41% dei posti letto attualmente disponibili. Negli ultimi sette giorni la variazione percentuale complessiva è stata +3.4%",6,,,,,,
Decessi,https://github.com/Paulsword/PilloleOttimismo/raw/main/Cover7.jpg,467,"In media abbiamo avuto in Italia 430 DECESSI al giorno negli ultimi sette giorni, e 415 nei sette giorni precedenti. La variazione dei decessi in questi ultimi sette giorni, rispetto ai sette precedenti, è stata pari a +3.4% (ieri era +4.2%, il giorno prima +6.8%, prima ancora +6.9%, +8.4%, +12.6%, +10.2%).",7,,,,,,
Vaccini,https://github.com/Paulsword/PilloleOttimismo/raw/main/Cover8.jpg,10018265,"Ad oggi in Italia abbiamo eseguito 10018265 dosi di vaccino. 6875106 persone, pari al 11.53% della popolazione, hanno ricevuto la prima dose, e 3143159 persone, pari al 5.27% della popolazione, hanno ricevuto anche la seconda dose.",8,,,,,,
Zone rosse,https://github.com/Paulsword/PilloleOttimismo/raw/main/Cover9.jpg,73,"Delle attuali 73 Province in fascia rossa, 33 (pari a 17868559 persone) hanno un'incidenza al di sotto dei 250 casi settimanali ogni 100.000 abitanti. Qui proponiamo un modello su base provinciale e con soglia di incidenza rigorosamente correlata alla ricettività ospedaliera. Al momento, 33 Province al di sotto di quella soglia sono in regime di restrizione, e 7 di queste sono in fascia rossa. Viceversa, 8 Province che secondo il nostro modello sono sopra-soglia, si trovano invece in arancione.",9,,,,,,
