Title,Image,Subtitle,Trend,Color,,,,,,
Aggiornamento,https://github.com/Paulsword/PilloleOttimismo/raw/main/Cover0.jpg,5 maggio 2021,,1,,,,,,
Incidenza,https://github.com/Paulsword/PilloleOttimismo/raw/main/Cover1.jpg,127,"L'INCIDENZA su base nazionale è al momento pari a 127 nuovi positivi ogni 100.000 abitanti in 7 giorni. Le Regioni con i valori più elevati sono Valle d'Aosta, con 204 casi, seguono Campania (191), Puglia (185), e Basilicata (161). L'incidenza più bassa è in Molise, con 64 casi.
Nei grafici trovate i valori di incidenza dei Paesi d'Europa, calcolati su 14 giorni.",2,,,,,,
Variazione,https://github.com/Paulsword/PilloleOttimismo/raw/main/Cover2.jpg,-16.1%,"La VARIAZIONE PERCENTUALE dei nuovi casi negli ultimi sette giorni, rispetto ai sette precedenti, è stata pari a -16.1% (ieri era -13.4%, il giorno prima -13.6%, prima ancora -11.3%, -6.5%, -7.1%, -6.9%). I valori più elevati tra le Regioni si riscontrano in Bolzano (+28.3% negli ultimi sette giorni rispetto ai sette precedenti), Umbria (+4.1%), Abruzzo (-1.5%), Emilia Romagna (-9.8%), Toscana (-10.5%), Molise (-11.5%), Campania (-12.8%), Marche (-14.3%), Basilicata (-14.6%).",3,,,,,,
Nuovi casi,https://github.com/Paulsword/PilloleOttimismo/raw/main/Cover3.jpg,10585,"Sono 10585 i nuovi positivi registrati oggi, su 327169 tamponi (3.2%) e 114357 persone testate (9.26%).
Negli ultimi sette giorni abbiamo avuto in media 10787 nuovi positivi al giorno, ossia -2069 casi al giorno rispetto ai sette giorni precedenti (ieri era -1735).",4,,,,,,
Ricoveri,https://github.com/Paulsword/PilloleOttimismo/raw/main/Cover6.jpg,-656,"Abbiamo attualmente 17520 pazienti RICOVERATI IN REPARTO, pari al 28% dei posti letto disponibili (fonte: AGENAS). Negli ultimi 7 giorni la variazione media del numero di pazienti ricoverati è stata pari a -334 pazienti al giorno (era -418 nei sette giorni precedenti). La variazione percentuale complessiva sul totale dei pazienti ricoverati in questi sette giorni è stata -11.8%",5,,,,,,
TI,https://github.com/Paulsword/PilloleOttimismo/raw/main/Cover5.jpg,-55,"Oggi in TERAPIA INTENSIVA saldo di -55 pazienti (142 ingressi e 197 uscite). La variazione del totale degli INGRESSI in TI negli ultimi sette giorni, rispetto ai sette giorni precedenti, è stata del -13.6% (ieri era -10%, il giorno prima -6.6%).
I pazienti in TI sono complessivamente 2368, pari al 26% dei posti letto attualmente disponibili. Negli ultimi sette giorni la variazione percentuale complessiva è stata -12.7%",6,,,,,,
Decessi,https://github.com/Paulsword/PilloleOttimismo/raw/main/Cover7.jpg,267,"In media abbiamo avuto in Italia 250 DECESSI al giorno negli ultimi sette giorni, e 323 nei sette giorni precedenti. La variazione dei decessi in questi ultimi sette giorni, rispetto ai sette precedenti, è stata pari a -22.6% (ieri era -19.9%, il giorno prima -17.5%, prima ancora -16.1%, -14.2%, -9.6%, -9.6%).",7,,,,,,
Vaccini,https://github.com/Paulsword/PilloleOttimismo/raw/main/Cover8.jpg,422 246,"Il 4/5/2021 sono state 422 246 le somministrazioni di vaccino. Ad oggi in Italia abbiamo eseguito 21 771 822 dosi. Il 25.66% della popolazione ha ricevuto almeno una dose, e il 11.03% della popolazione ha ricevuto vaccinazione completa.",8,,,,,,
Zone rosse,https://github.com/Paulsword/PilloleOttimismo/raw/main/Cover9.jpg,14,"Qui proponiamo un modello di monitoraggio su base provinciale e con soglia di incidenza correlata alla ricettività ospedaliera (slide 10 e 11). Al momento, 14 Province sono sopra quella soglia. Di queste, 0 sono realmente in fascia rossa, 9 sono in fascia arancione e 5 sono in fascia gialla. Viceversa, delle 93 Province per noi attualmente VERDI, perchè al di sotto di quella soglia, 18 si trovano in fascia arancione, 1 in rosso, 74 in giallo.",9,,,,,,
