Title,Image,Subtitle,Trend,Color,,,,,,
Aggiornamento,https://github.com/Paulsword/PilloleOttimismo/raw/main/Cover0.jpg,26 febbraio 2022,,1,,,,,,
Incidenza,https://github.com/Paulsword/PilloleOttimismo/raw/main/Cover1.jpg,514,"L'INCIDENZA su base nazionale è al momento pari a 514 nuovi positivi ogni 100.000 abitanti in 7 giorni (ieri era 535). Le Regioni con i valori più elevati sono Bolzano, con 746 casi, Abruzzo (717), Sicilia (688), e Marche (684). L'incidenza più bassa è in Valle d'Aosta, con 237 casi.",2,,,,,,
Variazione,https://github.com/Paulsword/PilloleOttimismo/raw/main/Cover2.jpg,-18.5%,"La VARIAZIONE PERCENTUALE dei nuovi casi negli ultimi sette giorni, rispetto ai sette precedenti, è stata pari a -18.5% (ieri era -17.9%, il giorno prima -17.8%, prima ancora -18.8%, -20.6%, -23.5%, -24.7%). I valori più elevati tra le Regioni si riscontrano in Calabria (-7.1% negli ultimi sette giorni rispetto ai sette precedenti), Umbria (-10.5%), Liguria (-11.1%), Sicilia (-11.4%), Lombardia (-12.4%), Abruzzo (-14.3%), Puglia (-15.3%), Molise (-15.8%), Lazio (-16.7%).",3,,,,,,
Nuovi casi,https://github.com/Paulsword/PilloleOttimismo/raw/main/Cover3.jpg,38375,"Sono 38375 i nuovi positivi registrati oggi, su 434077 tamponi (8.8%).
Negli ultimi sette giorni abbiamo avuto in media 43529 nuovi positivi al giorno, ossia -9887 casi al giorno rispetto ai sette giorni precedenti (ieri era -9850).",4,,,,,,
Ricoveri,https://github.com/Paulsword/PilloleOttimismo/raw/main/Cover6.jpg,-603,"Abbiamo attualmente 11103 pazienti RICOVERATI IN REPARTO, pari al 17% dei posti letto disponibili (fonte: AGENAS). Negli ultimi 7 giorni la variazione media del numero di pazienti ricoverati è stata pari a -326 pazienti al giorno (era -418 nei sette giorni precedenti). La variazione percentuale complessiva sul totale dei pazienti ricoverati in questi sette giorni è stata -17.1%",5,,,,,,
TI,https://github.com/Paulsword/PilloleOttimismo/raw/main/Cover5.jpg,-36,"Oggi in TERAPIA INTENSIVA saldo di -36 pazienti (44 ingressi e 80 uscite). La variazione del totale degli INGRESSI in TI negli ultimi sette giorni, rispetto ai sette giorni precedenti, è stata del -12.7% (ieri era -4.6%, il giorno prima -14.3%).
I pazienti in TI sono complessivamente 763, pari al 7.9% dei posti letto attualmente disponibili. Negli ultimi sette giorni la variazione percentuale complessiva è stata -19.9%",6,,,,,,
Decessi,https://github.com/Paulsword/PilloleOttimismo/raw/main/Cover7.jpg,210,"In media abbiamo registrato in Italia 224 DECESSI al giorno negli ultimi sette giorni, e 289 nei sette giorni precedenti. La variazione dei decessi in questi ultimi sette giorni, rispetto ai sette precedenti, è stata pari a -22.5% (ieri era -21.1%, il giorno prima -16%, prima ancora -12.8%, -15.8%, -13.9%, -12%). Si ricordi tuttavia che molti decessi registrati risalgono alle settimane o ai mesi precedenti.",7,,,,,,
Vaccini,https://github.com/Paulsword/PilloleOttimismo/raw/main/Cover8.jpg,126 930,"Il 25/2/2022 sono state 126 930 le somministrazioni di vaccino. Ad oggi in Italia abbiamo eseguito 133 383 841 dosi. Il 85.42% della popolazione ha ricevuto almeno una dose, e il 83.16% della popolazione ha ricevuto vaccinazione completa. 37327312 persone hanno ricevuto una dose aggiuntiva (62.99% della popolazione).
NB: queste percentuali variano, come vedrete nelle slide, se per valutare la copertura immunitaria efficace si considerano anche i 14 giorni necessari per lo sviluppo anticorpale dopo la somministrazione.",8,,,,,,
