Title,Image,Subtitle,Trend,Color,,,,,,
Aggiornamento,https://github.com/Paulsword/PilloleOttimismo/raw/main/Cover0.jpg,29 agosto 2021,,1,,,,,,
Incidenza,https://github.com/Paulsword/PilloleOttimismo/raw/main/Cover1.jpg,77,"L'INCIDENZA su base nazionale è al momento pari a 77 nuovi positivi ogni 100.000 abitanti in 7 giorni (ieri era 76.9). Le Regioni con i valori più elevati sono Sicilia, con 192.3 casi, Sardegna (138.5), Toscana (114), e Calabria (108.2). L'incidenza più bassa è in Valle d'Aosta, con 24.2 casi.",2,,,,,,
Variazione,https://github.com/Paulsword/PilloleOttimismo/raw/main/Cover2.jpg,+3.8%,"La VARIAZIONE PERCENTUALE dei nuovi casi negli ultimi sette giorni, rispetto ai sette precedenti, è stata pari a +3.8% (ieri era +4.4%, il giorno prima +6.5%, prima ancora +4.6%, +4.7%, +4.2%, +1.6%). I valori più elevati tra le Regioni si riscontrano in Molise (+60.3% negli ultimi sette giorni rispetto ai sette precedenti), Friuli VG (+34.2%), Calabria (+28%), Veneto (+21.2%), Basilicata (+21%), Marche (+19.6%), Bolzano (+13.8%), Lombardia (+12.5%), Piemonte (+7.5%).",3,,,,,,
Nuovi casi,https://github.com/Paulsword/PilloleOttimismo/raw/main/Cover3.jpg,5959,"Sono 5959 i nuovi positivi registrati oggi, su 223086 tamponi (2.7%) e 56121 persone testate (10.62%).
Negli ultimi sette giorni abbiamo avuto in media 6519 nuovi positivi al giorno, ossia +241 casi al giorno rispetto ai sette giorni precedenti (ieri era +273).",4,,,,,,
Ricoveri,https://github.com/Paulsword/PilloleOttimismo/raw/main/Cover6.jpg,+22,"Abbiamo attualmente 4133 pazienti RICOVERATI IN REPARTO, pari al 7.1% dei posti letto disponibili (fonte: AGENAS). Negli ultimi 7 giorni la variazione media del numero di pazienti ricoverati è stata pari a +52 pazienti al giorno (era +86 nei sette giorni precedenti). La variazione percentuale complessiva sul totale dei pazienti ricoverati in questi sette giorni è stata +9.7%",5,,,,,,
TI,https://github.com/Paulsword/PilloleOttimismo/raw/main/Cover5.jpg,+14,"Oggi in TERAPIA INTENSIVA saldo di +14 pazienti (44 ingressi e 30 uscite). La variazione del totale degli INGRESSI in TI negli ultimi sette giorni, rispetto ai sette giorni precedenti, è stata del +7.8% (ieri era +5.3%, il giorno prima +5.7%).
I pazienti in TI sono complessivamente 525, pari al 5.8% dei posti letto attualmente disponibili. Negli ultimi sette giorni la variazione percentuale complessiva è stata +11.2%",6,,,,,,
Decessi,https://github.com/Paulsword/PilloleOttimismo/raw/main/Cover7.jpg,37,"In media abbiamo registrato in Italia 49 DECESSI al giorno negli ultimi sette giorni, e 46 nei sette giorni precedenti. La variazione dei decessi in questi ultimi sette giorni, rispetto ai sette precedenti, è stata pari a +7.2% (ieri era +4.1%, il giorno prima +4.9%, prima ancora +7.7%, +21.8%, +45.6%, +58.4%). Si ricordi tuttavia che molti decessi registrati risalgono alle settimane o ai mesi precedenti.",7,,,,,,
Vaccini,https://github.com/Paulsword/PilloleOttimismo/raw/main/Cover8.jpg,216 572,"Il 28/8/2021 sono state 216 572 le somministrazioni di vaccino. Ad oggi in Italia abbiamo eseguito 77 145 747 dosi. Il 71.39% della popolazione ha ricevuto almeno una dose, e il 63.21% della popolazione ha ricevuto vaccinazione completa.",8,,,,,,
