Title,Image,Subtitle,Trend,Color,,,,,,
Aggiornamento,https://github.com/Paulsword/PilloleOttimismo/raw/main/Cover0.jpg,28 agosto 2021,,1,,,,,,
Incidenza,https://github.com/Paulsword/PilloleOttimismo/raw/main/Cover1.jpg,77,"L'INCIDENZA su base nazionale è al momento pari a 77 nuovi positivi ogni 100.000 abitanti in 7 giorni (ieri era 78). Le Regioni con i valori più elevati sono Sicilia, con 191.9 casi, Sardegna (136.8), Toscana (115.8), e Calabria (106.8). L'incidenza più bassa è in Valle d'Aosta, con 27.4 casi.",2,,,,,,
Variazione,https://github.com/Paulsword/PilloleOttimismo/raw/main/Cover2.jpg,+4.4%,"La VARIAZIONE PERCENTUALE dei nuovi casi negli ultimi sette giorni, rispetto ai sette precedenti, è stata pari a +4.4% (ieri era +6.5%, il giorno prima +4.6%, prima ancora +4.7%, +4.2%, +1.6%, -0.7%). I valori più elevati tra le Regioni si riscontrano in Friuli VG (+37.9% negli ultimi sette giorni rispetto ai sette precedenti), Calabria (+23.4%), Molise (+22.5%), Bolzano (+21.5%), Marche (+16.8%), Veneto (+15.8%), Lombardia (+13.8%), Basilicata (+11.3%), Campania (+8.3%).",3,,,,,,
Nuovi casi,https://github.com/Paulsword/PilloleOttimismo/raw/main/Cover3.jpg,6860,"Sono 6860 i nuovi positivi registrati oggi, su 293464 tamponi (2.3%) e 62448 persone testate (10.99%).
Negli ultimi sette giorni abbiamo avuto in media 6515 nuovi positivi al giorno, ossia +274 casi al giorno rispetto ai sette giorni precedenti (ieri era +402).",4,,,,,,
Ricoveri,https://github.com/Paulsword/PilloleOttimismo/raw/main/Cover6.jpg,-3,"Abbiamo attualmente 4111 pazienti RICOVERATI IN REPARTO, pari al 7.1% dei posti letto disponibili (fonte: AGENAS). Negli ultimi 7 giorni la variazione media del numero di pazienti ricoverati è stata pari a +54 pazienti al giorno (era +90 nei sette giorni precedenti). La variazione percentuale complessiva sul totale dei pazienti ricoverati in questi sette giorni è stata +10.1%",5,,,,,,
TI,https://github.com/Paulsword/PilloleOttimismo/raw/main/Cover5.jpg,0,"Oggi in TERAPIA INTENSIVA saldo di 0 pazienti (42 ingressi e 42 uscite). La variazione del totale degli INGRESSI in TI negli ultimi sette giorni, rispetto ai sette giorni precedenti, è stata del +5.3% (ieri era +5.7%, il giorno prima -3.7%).
I pazienti in TI sono complessivamente 511, pari al 5.7% dei posti letto attualmente disponibili. Negli ultimi sette giorni la variazione percentuale complessiva è stata +9.7%",6,,,,,,
Decessi,https://github.com/Paulsword/PilloleOttimismo/raw/main/Cover7.jpg,54,"In media abbiamo registrato in Italia 47 DECESSI al giorno negli ultimi sette giorni, e 45 nei sette giorni precedenti. La variazione dei decessi in questi ultimi sette giorni, rispetto ai sette precedenti, è stata pari a +4.1% (ieri era +4.9%, il giorno prima +7.7%, prima ancora +21.8%, +45.6%, +58.4%, +50.5%). Si ricordi tuttavia che molti decessi registrati risalgono alle settimane o ai mesi precedenti.",7,,,,,,
Vaccini,https://github.com/Paulsword/PilloleOttimismo/raw/main/Cover8.jpg,276 770,"Il 27/8/2021 sono state 276 770 le somministrazioni di vaccino. Ad oggi in Italia abbiamo eseguito 77 017 691 dosi. Il 71.3% della popolazione ha ricevuto almeno una dose, e il 63.08% della popolazione ha ricevuto vaccinazione completa.",8,,,,,,
