Title,Image,Subtitle,Trend,Color,,,,,,
Aggiornamento,https://github.com/Paulsword/PilloleOttimismo/raw/main/Cover0.jpg,1 settembre 2021,,1,,,,,,
Incidenza,https://github.com/Paulsword/PilloleOttimismo/raw/main/Cover1.jpg,74.4,"L'INCIDENZA su base nazionale è al momento pari a 74.4 nuovi positivi ogni 100.000 abitanti in 7 giorni (ieri era 76.2). Le Regioni con i valori più elevati sono Sicilia, con 188.6 casi, Sardegna (127.2), Toscana (104.3), e Calabria (102). L'incidenza più bassa è in Valle d'Aosta, con 20.2 casi.",2,,,,,,
Variazione,https://github.com/Paulsword/PilloleOttimismo/raw/main/Cover2.jpg,-3.4%,"La VARIAZIONE PERCENTUALE dei nuovi casi negli ultimi sette giorni, rispetto ai sette precedenti, è stata pari a -3.4% (ieri era -0.2%, il giorno prima +2.8%, prima ancora +3.8%, +4.4%, +6.5%, +4.6%). I valori più elevati tra le Regioni si riscontrano in Molise (+54.7% negli ultimi sette giorni rispetto ai sette precedenti), Lombardia (+14.6%), Veneto (+12.2%), Basilicata (+11.1%), Marche (+6.9%), Piemonte (+6.2%), Emilia Romagna (+3.8%), Calabria (+3.4%), Umbria (+3%).",3,,,,,,
Nuovi casi,https://github.com/Paulsword/PilloleOttimismo/raw/main/Cover3.jpg,6503,"Sono 6503 i nuovi positivi registrati oggi, su 303717 tamponi (2.1%) e 68051 persone testate (9.56%).
Negli ultimi sette giorni abbiamo avuto in media 6300 nuovi positivi al giorno, ossia -220 casi al giorno rispetto ai sette giorni precedenti (ieri era -16).",4,,,,,,
Ricoveri,https://github.com/Paulsword/PilloleOttimismo/raw/main/Cover6.jpg,-21,"Abbiamo attualmente 4231 pazienti RICOVERATI IN REPARTO, pari al 7.3% dei posti letto disponibili (fonte: AGENAS). Negli ultimi 7 giorni la variazione media del numero di pazienti ricoverati è stata pari a +30 pazienti al giorno (era +66 nei sette giorni precedenti). La variazione percentuale complessiva sul totale dei pazienti ricoverati in questi sette giorni è stata +5.2%",5,,,,,,
TI,https://github.com/Paulsword/PilloleOttimismo/raw/main/Cover5.jpg,-4,"Oggi in TERAPIA INTENSIVA saldo di -4 pazienti (40 ingressi e 44 uscite). La variazione del totale degli INGRESSI in TI negli ultimi sette giorni, rispetto ai sette giorni precedenti, è stata del +15.5% (ieri era +6.8%, il giorno prima +4.6%).
I pazienti in TI sono complessivamente 540, pari al 6% dei posti letto attualmente disponibili. Negli ultimi sette giorni la variazione percentuale complessiva è stata +8.2%",6,,,,,,
Decessi,https://github.com/Paulsword/PilloleOttimismo/raw/main/Cover7.jpg,69,"In media abbiamo registrato in Italia 54 DECESSI al giorno negli ultimi sette giorni, e 48 nei sette giorni precedenti. La variazione dei decessi in questi ultimi sette giorni, rispetto ai sette precedenti, è stata pari a +12.2% (ieri era +6.1%, il giorno prima +3.5%, prima ancora +7.2%, +4.1%, +4.9%, +7.7%). Si ricordi tuttavia che molti decessi registrati risalgono alle settimane o ai mesi precedenti.",7,,,,,,
Vaccini,https://github.com/Paulsword/PilloleOttimismo/raw/main/Cover8.jpg,306 732,"Il 31/8/2021 sono state 306 732 le somministrazioni di vaccino. Ad oggi in Italia abbiamo eseguito 77 978 592 dosi. Il 72.01% della popolazione ha ricevuto almeno una dose, e il 64.07% della popolazione ha ricevuto vaccinazione completa.",8,,,,,,
