Title,Image,Subtitle,Trend,Color,,,,,,
Aggiornamento,https://github.com/Paulsword/PilloleOttimismo/raw/main/Cover0.jpg,1 gennaio 2022,,1,,,,,,
Incidenza,https://github.com/Paulsword/PilloleOttimismo/raw/main/Cover1.jpg,1087.4,"L'INCIDENZA su base nazionale è al momento pari a 1087.4 nuovi positivi ogni 100.000 abitanti in 7 giorni (ieri era 941.5). Le Regioni con i valori più elevati sono Umbria, con 1957.3 casi, Lombardia (1896.4), Toscana (1782.4), e Valle d'Aosta (1317.2). L'incidenza più bassa è in Sardegna, con 298.5 casi.",2,,,,,,
Variazione,https://github.com/Paulsword/PilloleOttimismo/raw/main/Cover2.jpg,+150.1%,"La VARIAZIONE PERCENTUALE dei nuovi casi negli ultimi sette giorni, rispetto ai sette precedenti, è stata pari a +150.1% (ieri era +141.6%, il giorno prima +122.4%, prima ancora +100.7%, +80.7%, +63.2%, +57.8%). I valori più elevati tra le Regioni si riscontrano in Molise (+395.6% negli ultimi sette giorni rispetto ai sette precedenti), Toscana (+329.2%), Abruzzo (+305.8%), Umbria (+243.4%), Puglia (+224.6%), Campania (+186.4%), Trento (+172.2%), Lombardia (+158.4%), Piemonte (+142.8%).",3,,,,,,
Nuovi casi,https://github.com/Paulsword/PilloleOttimismo/raw/main/Cover3.jpg,141262,"Sono 141262 i nuovi positivi registrati oggi, su 1084295 tamponi (13%) e 175035 persone testate (80.71%).
Negli ultimi sette giorni abbiamo avuto in media 92054 nuovi positivi al giorno, ossia +55250 casi al giorno rispetto ai sette giorni precedenti (ieri era +46716).",4,,,,,,
Ricoveri,https://github.com/Paulsword/PilloleOttimismo/raw/main/Cover6.jpg,+115,"Abbiamo attualmente 11265 pazienti RICOVERATI IN REPARTO, pari al 17.6% dei posti letto disponibili (fonte: AGENAS). Negli ultimi 7 giorni la variazione media del numero di pazienti ricoverati è stata pari a +339 pazienti al giorno (era +188 nei sette giorni precedenti). La variazione percentuale complessiva sul totale dei pazienti ricoverati in questi sette giorni è stata +26.7%",5,,,,,,
TI,https://github.com/Paulsword/PilloleOttimismo/raw/main/Cover5.jpg,+37,"Oggi in TERAPIA INTENSIVA saldo di +37 pazienti (135 ingressi e 98 uscite). La variazione del totale degli INGRESSI in TI negli ultimi sette giorni, rispetto ai sette giorni precedenti, è stata del +27.8% (ieri era +25.4%, il giorno prima +29.3%).
I pazienti in TI sono complessivamente 1297, pari al 15.1% dei posti letto attualmente disponibili. Negli ultimi sette giorni la variazione percentuale complessiva è stata +21.1%",6,,,,,,
Decessi,https://github.com/Paulsword/PilloleOttimismo/raw/main/Cover7.jpg,111,"In media abbiamo registrato in Italia 140 DECESSI al giorno negli ultimi sette giorni, e 141 nei sette giorni precedenti. La variazione dei decessi in questi ultimi sette giorni, rispetto ai sette precedenti, è stata pari a -0.3% (ieri era +5.3%, il giorno prima +6.1%, prima ancora +12.8%, +14.7%, +14.8%, +19.8%). Si ricordi tuttavia che molti decessi registrati risalgono alle settimane o ai mesi precedenti.",7,,,,,,
Vaccini,https://github.com/Paulsword/PilloleOttimismo/raw/main/Cover8.jpg,270 136,"Il 31/12/2021 sono state 270 136 le somministrazioni di vaccino. Ad oggi in Italia abbiamo eseguito 111 116 172 dosi. Il 81.63% della popolazione ha ricevuto almeno una dose, e il 78.26% della popolazione ha ricevuto vaccinazione completa. 19563209 persone hanno ricevuto una dose aggiuntiva (33.01% della popolazione).
NB: queste percentuali variano, come vedrete nelle slide, se per valutare la copertura immunitaria efficace si considerano anche i 14 giorni necessari per lo sviluppo anticorpale dopo la somministrazione.",8,,,,,,
