Title,Image,Subtitle,Trend,Color,,,,,,
Aggiornamento,https://github.com/Paulsword/PilloleOttimismo/raw/main/Cover0.jpg,4 luglio 2021,,1,,,,,,
Incidenza,https://github.com/Paulsword/PilloleOttimismo/raw/main/Cover1.jpg,8.9,"L'INCIDENZA su base nazionale è al momento pari a 8.9 nuovi positivi ogni 100.000 abitanti in 7 giorni. Le Regioni con i valori più elevati sono Sicilia, con 16.8 casi, seguono Abruzzo (14.6), Campania (13), e Marche (11.5). L'incidenza più bassa è in Molise, con 2.4 casi.
Nei grafici trovate i valori di incidenza dei Paesi d'Europa, calcolati su 14 giorni.",2,,,,,,
Variazione,https://github.com/Paulsword/PilloleOttimismo/raw/main/Cover2.jpg,-5.7%,"La VARIAZIONE PERCENTUALE dei nuovi casi negli ultimi sette giorni, rispetto ai sette precedenti, è stata pari a -5.7% (ieri era -7.7%, il giorno prima -14.8%, prima ancora -20.6%, -24.6%, -26.8%, -28.9%). I valori più elevati tra le Regioni si riscontrano in Marche (+130.7% negli ultimi sette giorni rispetto ai sette precedenti), Abruzzo (+30.6%), Bolzano (+23.5%), Trento (+22.2%), Campania (+14.4%), Liguria (+12.9%), Veneto (+12.2%), Sardegna (+4.5%), Sicilia (+3.7%).",3,,,,,,
Nuovi casi,https://github.com/Paulsword/PilloleOttimismo/raw/main/Cover3.jpg,808,"Sono 808 i nuovi positivi registrati oggi, su 141640 tamponi (0.6%) e 42000 persone testate (1.92%).
Negli ultimi sette giorni abbiamo avuto in media 750 nuovi positivi al giorno, ossia -46 casi al giorno rispetto ai sette giorni precedenti (ieri era -62).",4,,,,,,
Ricoveri,https://github.com/Paulsword/PilloleOttimismo/raw/main/Cover6.jpg,-30,"Abbiamo attualmente 1364 pazienti RICOVERATI IN REPARTO, pari al 2.4% dei posti letto disponibili (fonte: AGENAS). Negli ultimi 7 giorni la variazione media del numero di pazienti ricoverati è stata pari a -54 pazienti al giorno (era -100 nei sette giorni precedenti). La variazione percentuale complessiva sul totale dei pazienti ricoverati in questi sette giorni è stata -21.7%",5,,,,,,
TI,https://github.com/Paulsword/PilloleOttimismo/raw/main/Cover5.jpg,-7,"Oggi in TERAPIA INTENSIVA saldo di -7 pazienti (7 ingressi e 14 uscite). La variazione del totale degli INGRESSI in TI negli ultimi sette giorni, rispetto ai sette giorni precedenti, è stata del -40.3% (ieri era -37.5%, il giorno prima -27.7%).
I pazienti in TI sono complessivamente 197, pari al 2.3% dei posti letto attualmente disponibili. Negli ultimi sette giorni la variazione percentuale complessiva è stata -33%",6,,,,,,
Decessi,https://github.com/Paulsword/PilloleOttimismo/raw/main/Cover7.jpg,12,"In media abbiamo avuto in Italia 25 DECESSI al giorno negli ultimi sette giorni, e 29 nei sette giorni precedenti. La variazione dei decessi in questi ultimi sette giorni, rispetto ai sette precedenti, è stata pari a -12.4% (ieri era -12.7%, il giorno prima +2.1%, prima ancora +30.8%, +27.5%, -0.5%, -17.4%).",7,,,,,,
Vaccini,https://github.com/Paulsword/PilloleOttimismo/raw/main/Cover8.jpg,504 660,"Il 3/7/2021 sono state 504 660 le somministrazioni di vaccino. Ad oggi in Italia abbiamo eseguito 53 385 493 dosi. Il 58.51% della popolazione ha ricevuto almeno una dose, e il 33.68% della popolazione ha ricevuto vaccinazione completa.",8,,,,,,
