Title,Image,Subtitle,Trend,Color,,,,,,
Aggiornamento,https://github.com/Paulsword/PilloleOttimismo/raw/main/Cover0.jpg,3 agosto 2021,,1,,,,,,
Incidenza,https://github.com/Paulsword/PilloleOttimismo/raw/main/Cover1.jpg,64.7,"L'INCIDENZA su base nazionale è al momento pari a 64.7 nuovi positivi ogni 100.000 abitanti in 7 giorni. Le Regioni con i valori più elevati sono Sardegna, con 134.9 casi, seguono Toscana (115.9), Sicilia (95.5), e Veneto (94). L'incidenza più bassa è in Molise, con 20.9 casi.
Nei grafici trovate i valori di incidenza dei Paesi d'Europa, calcolati su 14 giorni.",2,,,,,,
Variazione,https://github.com/Paulsword/PilloleOttimismo/raw/main/Cover2.jpg,+19.9%,"La VARIAZIONE PERCENTUALE dei nuovi casi negli ultimi sette giorni, rispetto ai sette precedenti, è stata pari a +19.9% (ieri era +22.6%, il giorno prima +26.6%, prima ancora +31.8%, +36.7%, +43.3%, +55.5%). I valori più elevati tra le Regioni si riscontrano in Basilicata (+80.7% negli ultimi sette giorni rispetto ai sette precedenti), Valle d'Aosta (+54.5%), Marche (+51.2%), Abruzzo (+50.7%), Toscana (+48.2%), Piemonte (+47%), Puglia (+34.7%), Calabria (+31.8%), Campania (+30.8%).",3,,,,,,
Nuovi casi,https://github.com/Paulsword/PilloleOttimismo/raw/main/Cover3.jpg,4845,"Sono 4845 i nuovi positivi registrati oggi, su 209719 tamponi (2.3%) e 50495 persone testate (9.6%).
Negli ultimi sette giorni abbiamo avuto in media 5476 nuovi positivi al giorno, ossia +910 casi al giorno rispetto ai sette giorni precedenti (ieri era +1001).",4,,,,,,
Ricoveri,https://github.com/Paulsword/PilloleOttimismo/raw/main/Cover6.jpg,+126,"Abbiamo attualmente 2196 pazienti RICOVERATI IN REPARTO, pari al 4% dei posti letto disponibili (fonte: AGENAS). Negli ultimi 7 giorni la variazione media del numero di pazienti ricoverati è stata pari a +84 pazienti al giorno (era +60 nei sette giorni precedenti). La variazione percentuale complessiva sul totale dei pazienti ricoverati in questi sette giorni è stata +36.3%",5,,,,,,
TI,https://github.com/Paulsword/PilloleOttimismo/raw/main/Cover5.jpg,+9,"Oggi in TERAPIA INTENSIVA saldo di +9 pazienti (26 ingressi e 17 uscite). La variazione del totale degli INGRESSI in TI negli ultimi sette giorni, rispetto ai sette giorni precedenti, è stata del +54.7% (ieri era +52.2%, il giorno prima +29.5%).
I pazienti in TI sono complessivamente 258, pari al 3% dei posti letto attualmente disponibili. Negli ultimi sette giorni la variazione percentuale complessiva è stata +36.5%",6,,,,,,
Decessi,https://github.com/Paulsword/PilloleOttimismo/raw/main/Cover7.jpg,27,"In media abbiamo registrato in Italia 17 DECESSI al giorno negli ultimi sette giorni, e 16 nei sette giorni precedenti. La variazione dei decessi in questi ultimi sette giorni, rispetto ai sette precedenti, è stata pari a +8.1% (ieri era +20.6%, il giorno prima +41.5%, prima ancora +55.1%, +27.9%, +36.3%, +41.9%). Si ricordi tuttavia che molti decessi registrati risalgono alle settimane o ai mesi precedenti.",7,,,,,,
Vaccini,https://github.com/Paulsword/PilloleOttimismo/raw/main/Cover8.jpg,422 916,"Il 2/8/2021 sono state 422 916 le somministrazioni di vaccino. Ad oggi in Italia abbiamo eseguito 69 391 935 dosi. Il 65.33% della popolazione ha ricevuto almeno una dose, e il 55.7% della popolazione ha ricevuto vaccinazione completa.",8,,,,,,
