Title,Image,Subtitle,Trend,Color,,,,,,
Aggiornamento,https://github.com/Paulsword/PilloleOttimismo/raw/main/Cover0.jpg,7 febbraio 2022,,1,,,,,,
Incidenza,https://github.com/Paulsword/PilloleOttimismo/raw/main/Cover1.jpg,1144,"L'INCIDENZA su base nazionale è al momento pari a 1144 nuovi positivi ogni 100.000 abitanti in 7 giorni (ieri era 1174). Le Regioni con i valori più elevati sono Bolzano, con 1905 casi, Marche (1714), Veneto (1504), e Friuli VG (1480). L'incidenza più bassa è in Calabria, con 611 casi.",2,,,,,,
Variazione,https://github.com/Paulsword/PilloleOttimismo/raw/main/Cover2.jpg,-31%,"La VARIAZIONE PERCENTUALE dei nuovi casi negli ultimi sette giorni, rispetto ai sette precedenti, è stata pari a -31% (ieri era -30.6%, il giorno prima -30.3%, prima ancora -28.4%, -26.7%, -25.1%, -22.8%). I valori più elevati tra le Regioni si riscontrano in Sardegna (+60.8% negli ultimi sette giorni rispetto ai sette precedenti), Calabria (+15.9%), Sicilia (0%), Molise (-0.8%), Basilicata (-3.8%), Umbria (-16.1%), Campania (-18.6%), Puglia (-19.1%), Abruzzo (-23.6%).",3,,,,,,
Nuovi casi,https://github.com/Paulsword/PilloleOttimismo/raw/main/Cover3.jpg,41247,"Sono 41247 i nuovi positivi registrati oggi, su 393663 tamponi (10.5%).
Negli ultimi sette giorni abbiamo avuto in media 96858 nuovi positivi al giorno, ossia -43585 casi al giorno rispetto ai sette giorni precedenti (ieri era -43765).",4,,,,,,
Ricoveri,https://github.com/Paulsword/PilloleOttimismo/raw/main/Cover6.jpg,+177,"Abbiamo attualmente 18675 pazienti RICOVERATI IN REPARTO, pari al 28.5% dei posti letto disponibili (fonte: AGENAS). Negli ultimi 7 giorni la variazione media del numero di pazienti ricoverati è stata pari a -177 pazienti al giorno (era +7 nei sette giorni precedenti). La variazione percentuale complessiva sul totale dei pazienti ricoverati in questi sette giorni è stata -6.2%",5,,,,,,
TI,https://github.com/Paulsword/PilloleOttimismo/raw/main/Cover5.jpg,-8,"Oggi in TERAPIA INTENSIVA saldo di -8 pazienti (70 ingressi e 78 uscite). La variazione del totale degli INGRESSI in TI negli ultimi sette giorni, rispetto ai sette giorni precedenti, è stata del -15.8% (ieri era -9.5%, il giorno prima -14.6%).
I pazienti in TI sono complessivamente 1423, pari al 14.7% dei posti letto attualmente disponibili. Negli ultimi sette giorni la variazione percentuale complessiva è stata -10.2%",6,,,,,,
Decessi,https://github.com/Paulsword/PilloleOttimismo/raw/main/Cover7.jpg,326,"In media abbiamo registrato in Italia 371 DECESSI al giorno negli ultimi sette giorni, e 375 nei sette giorni precedenti. La variazione dei decessi in questi ultimi sette giorni, rispetto ai sette precedenti, è stata pari a -0.9% (ieri era -0.2%, il giorno prima +0.4%, prima ancora +2.2%, +0.2%, -0.6%, +2.5%). Si ricordi tuttavia che molti decessi registrati risalgono alle settimane o ai mesi precedenti.",7,,,,,,
Vaccini,https://github.com/Paulsword/PilloleOttimismo/raw/main/Cover8.jpg,187 699,"Il 6/2/2022 sono state 187 699 le somministrazioni di vaccino. Ad oggi in Italia abbiamo eseguito 130 075 081 dosi. Il 85.29% della popolazione ha ricevuto almeno una dose, e il 81.75% della popolazione ha ricevuto vaccinazione completa. 35095398 persone hanno ricevuto una dose aggiuntiva (59.23% della popolazione).
NB: queste percentuali variano, come vedrete nelle slide, se per valutare la copertura immunitaria efficace si considerano anche i 14 giorni necessari per lo sviluppo anticorpale dopo la somministrazione.",8,,,,,,
