Title,Image,Subtitle,Trend,Color,,,,,,
Aggiornamento,https://github.com/Paulsword/PilloleOttimismo/raw/main/Cover0.jpg,15 luglio 2021,,1,,,,,,
Incidenza,https://github.com/Paulsword/PilloleOttimismo/raw/main/Cover1.jpg,18.9,"L'INCIDENZA su base nazionale è al momento pari a 18.9 nuovi positivi ogni 100.000 abitanti in 7 giorni. Le Regioni con i valori più elevati sono Sicilia, con 32.2 casi, seguono Sardegna (31.9), Veneto (26.7), e Lazio (24). L'incidenza più bassa è in Valle d'Aosta, con 3.2 casi.
Nei grafici trovate i valori di incidenza dei Paesi d'Europa, calcolati su 14 giorni.",2,,,,,,
Variazione,https://github.com/Paulsword/PilloleOttimismo/raw/main/Cover2.jpg,+77.4%,"La VARIAZIONE PERCENTUALE dei nuovi casi negli ultimi sette giorni, rispetto ai sette precedenti, è stata pari a +77.4% (ieri era +74.6%, il giorno prima +61.4%, prima ancora +56.5%, +51.6%, +41.2%, +34.7%). I valori più elevati tra le Regioni si riscontrano in Sardegna (+272.3% negli ultimi sette giorni rispetto ai sette precedenti), Molise (+266.7%), Trento (+200%), Veneto (+137.1%), Lazio (+133.3%), Liguria (+112.2%), Bolzano (+109.5%), Lombardia (+100.4%), Umbria (+91.5%).",3,,,,,,
Nuovi casi,https://github.com/Paulsword/PilloleOttimismo/raw/main/Cover3.jpg,2455,"Sono 2455 i nuovi positivi registrati oggi, su 190922 tamponi (1.3%) e 44491 persone testate (5.52%).
Negli ultimi sette giorni abbiamo avuto in media 1600 nuovi positivi al giorno, ossia +698 casi al giorno rispetto ai sette giorni precedenti (ieri era +619).",4,,,,,,
Ricoveri,https://github.com/Paulsword/PilloleOttimismo/raw/main/Cover6.jpg,-19,"Abbiamo attualmente 1089 pazienti RICOVERATI IN REPARTO, pari al 2% dei posti letto disponibili (fonte: AGENAS). Negli ultimi 7 giorni la variazione media del numero di pazienti ricoverati è stata pari a -15 pazienti al giorno (era -48 nei sette giorni precedenti). La variazione percentuale complessiva sul totale dei pazienti ricoverati in questi sette giorni è stata -9%",5,,,,,,
TI,https://github.com/Paulsword/PilloleOttimismo/raw/main/Cover5.jpg,+2,"Oggi in TERAPIA INTENSIVA saldo di +2 pazienti (11 ingressi e 9 uscite). La variazione del totale degli INGRESSI in TI negli ultimi sette giorni, rispetto ai sette giorni precedenti, è stata del +19.5% (ieri era +15%, il giorno prima +30.6%).
I pazienti in TI sono complessivamente 153, pari al 1.8% dei posti letto attualmente disponibili. Negli ultimi sette giorni la variazione percentuale complessiva è stata -15%",6,,,,,,
Decessi,https://github.com/Paulsword/PilloleOttimismo/raw/main/Cover7.jpg,9,"In media abbiamo registrato in Italia 16 DECESSI al giorno negli ultimi sette giorni, e 21 nei sette giorni precedenti. La variazione dei decessi in questi ultimi sette giorni, rispetto ai sette precedenti, è stata pari a -24.3% (ieri era -25.7%, il giorno prima -35.8%, prima ancora -40%, -28.8%, -26.8%, -28.4%). Si ricordi tuttavia che molti decessi registrati risalgono alle settimane o ai mesi precedenti.",7,,,,,,
Vaccini,https://github.com/Paulsword/PilloleOttimismo/raw/main/Cover8.jpg,550 407,"Il 14/7/2021 sono state 550 407 le somministrazioni di vaccino. Ad oggi in Italia abbiamo eseguito 59 612 943 dosi. Il 61.06% della popolazione ha ricevuto almeno una dose, e il 43.03% della popolazione ha ricevuto vaccinazione completa.",8,,,,,,
