Title,Image,Subtitle,Trend,Color,,,,,,
Aggiornamento,https://github.com/Paulsword/PilloleOttimismo/raw/main/Cover0.jpg,2 gennaio 2022,,1,,,,,,
Incidenza,https://github.com/Paulsword/PilloleOttimismo/raw/main/Cover1.jpg,1148.6,"L'INCIDENZA su base nazionale è al momento pari a 1148.6 nuovi positivi ogni 100.000 abitanti in 7 giorni (ieri era 1087.6). Le Regioni con i valori più elevati sono Umbria, con 2008.2 casi, Lombardia (1955.1), Toscana (1872.2), e Valle d'Aosta (1388.3). L'incidenza più bassa è in Sardegna, con 325.5 casi.",2,,,,,,
Variazione,https://github.com/Paulsword/PilloleOttimismo/raw/main/Cover2.jpg,+163.6%,"La VARIAZIONE PERCENTUALE dei nuovi casi negli ultimi sette giorni, rispetto ai sette precedenti, è stata pari a +163.6% (ieri era +150.2%, il giorno prima +141.6%, prima ancora +122.4%, +100.7%, +80.7%, +63.2%). I valori più elevati tra le Regioni si riscontrano in Molise (+373.3% negli ultimi sette giorni rispetto ai sette precedenti), Abruzzo (+352.5%), Toscana (+305.4%), Umbria (+252.9%), Puglia (+245.2%), Campania (+209.4%), Trento (+192.6%), Basilicata (+187.9%), Lombardia (+169.4%).",3,,,,,,
Nuovi casi,https://github.com/Paulsword/PilloleOttimismo/raw/main/Cover3.jpg,61046,"Sono 61046 i nuovi positivi registrati oggi, su 278654 tamponi (21.9%) e 92074 persone testate (66.3%).
Negli ultimi sette giorni abbiamo avuto in media 97234 nuovi positivi al giorno, ossia +60341 casi al giorno rispetto ai sette giorni precedenti (ieri era +55263).",4,,,,,,
Ricoveri,https://github.com/Paulsword/PilloleOttimismo/raw/main/Cover6.jpg,+491,"Abbiamo attualmente 11756 pazienti RICOVERATI IN REPARTO, pari al 18.4% dei posti letto disponibili (fonte: AGENAS). Negli ultimi 7 giorni la variazione media del numero di pazienti ricoverati è stata pari a +362 pazienti al giorno (era +213 nei sette giorni precedenti). La variazione percentuale complessiva sul totale dei pazienti ricoverati in questi sette giorni è stata +27.5%",5,,,,,,
TI,https://github.com/Paulsword/PilloleOttimismo/raw/main/Cover5.jpg,+22,"Oggi in TERAPIA INTENSIVA saldo di +22 pazienti (104 ingressi e 82 uscite). La variazione del totale degli INGRESSI in TI negli ultimi sette giorni, rispetto ai sette giorni precedenti, è stata del +29.4% (ieri era +27.8%, il giorno prima +25.4%).
I pazienti in TI sono complessivamente 1319, pari al 15.4% dei posti letto attualmente disponibili. Negli ultimi sette giorni la variazione percentuale complessiva è stata +21.1%",6,,,,,,
Decessi,https://github.com/Paulsword/PilloleOttimismo/raw/main/Cover7.jpg,133,"In media abbiamo registrato in Italia 148 DECESSI al giorno negli ultimi sette giorni, e 139 nei sette giorni precedenti. La variazione dei decessi in questi ultimi sette giorni, rispetto ai sette precedenti, è stata pari a +6.7% (ieri era -0.3%, il giorno prima +5.3%, prima ancora +6.1%, +12.8%, +14.7%, +14.8%). Si ricordi tuttavia che molti decessi registrati risalgono alle settimane o ai mesi precedenti.",7,,,,,,
Vaccini,https://github.com/Paulsword/PilloleOttimismo/raw/main/Cover8.jpg,69 083,"Il 1/1/2022 sono state 69 083 le somministrazioni di vaccino. Ad oggi in Italia abbiamo eseguito 111 123 609 dosi. Il 81.64% della popolazione ha ricevuto almeno una dose, e il 78.26% della popolazione ha ricevuto vaccinazione completa. 19629779 persone hanno ricevuto una dose aggiuntiva (33.13% della popolazione).
NB: queste percentuali variano, come vedrete nelle slide, se per valutare la copertura immunitaria efficace si considerano anche i 14 giorni necessari per lo sviluppo anticorpale dopo la somministrazione.",8,,,,,,
