Title,Image,Subtitle,Trend,Color,,,,,,
Aggiornamento,https://github.com/Paulsword/PilloleOttimismo/raw/main/Cover0.jpg,8 dicembre 2021,,1,,,,,,
Incidenza,https://github.com/Paulsword/PilloleOttimismo/raw/main/Cover1.jpg,183.3,"L'INCIDENZA su base nazionale è al momento pari a 183.3 nuovi positivi ogni 100.000 abitanti in 7 giorni (ieri era 178.5). Le Regioni con i valori più elevati sono Bolzano, con 628.4 casi, Veneto (390.6), Friuli VG (386.4), e Valle d'Aosta (314.8). L'incidenza più bassa è in Molise, con 30 casi.",2,,,,,,
Variazione,https://github.com/Paulsword/PilloleOttimismo/raw/main/Cover2.jpg,+22%,"La VARIAZIONE PERCENTUALE dei nuovi casi negli ultimi sette giorni, rispetto ai sette precedenti, è stata pari a +22% (ieri era +22.4%, il giorno prima +22.8%, prima ancora +23.3%, +25.7%, +23%, +23.7%). I valori più elevati tra le Regioni si riscontrano in Umbria (+59.6% negli ultimi sette giorni rispetto ai sette precedenti), Basilicata (+51.3%), Piemonte (+42%), Abruzzo (+34.7%), Veneto (+30%), Liguria (+29.2%), Calabria (+28.9%), Puglia (+26.5%), Toscana (+25.9%).",3,,,,,,
Nuovi casi,https://github.com/Paulsword/PilloleOttimismo/raw/main/Cover3.jpg,17959,"Sono 17959 i nuovi positivi registrati oggi, su 564698 tamponi (3.2%) e 82085 persone testate (21.88%).
Negli ultimi sette giorni abbiamo avuto in media 15520 nuovi positivi al giorno, ossia +2799 casi al giorno rispetto ai sette giorni precedenti (ieri era +2764).",4,,,,,,
Ricoveri,https://github.com/Paulsword/PilloleOttimismo/raw/main/Cover6.jpg,+21,"Abbiamo attualmente 6099 pazienti RICOVERATI IN REPARTO, pari al 10.2% dei posti letto disponibili (fonte: AGENAS). Negli ultimi 7 giorni la variazione media del numero di pazienti ricoverati è stata pari a +122 pazienti al giorno (era +88 nei sette giorni precedenti). La variazione percentuale complessiva sul totale dei pazienti ricoverati in questi sette giorni è stata +16.2%",5,,,,,,
TI,https://github.com/Paulsword/PilloleOttimismo/raw/main/Cover5.jpg,+15,"Oggi in TERAPIA INTENSIVA saldo di +15 pazienti (62 ingressi e 47 uscite). La variazione del totale degli INGRESSI in TI negli ultimi sette giorni, rispetto ai sette giorni precedenti, è stata del +2.2% (ieri era +5.6%, il giorno prima 0%).
I pazienti in TI sono complessivamente 791, pari al 8.7% dei posti letto attualmente disponibili. Negli ultimi sette giorni la variazione percentuale complessiva è stata +15.3%",6,,,,,,
Decessi,https://github.com/Paulsword/PilloleOttimismo/raw/main/Cover7.jpg,86,"In media abbiamo registrato in Italia 77 DECESSI al giorno negli ultimi sette giorni, e 74 nei sette giorni precedenti. La variazione dei decessi in questi ultimi sette giorni, rispetto ai sette precedenti, è stata pari a +4.8% (ieri era +12%, il giorno prima +11.4%, prima ancora +4.8%, +5.8%, +18.7%, +14.4%). Si ricordi tuttavia che molti decessi registrati risalgono alle settimane o ai mesi precedenti.",7,,,,,,
Vaccini,https://github.com/Paulsword/PilloleOttimismo/raw/main/Cover8.jpg,508 603,"Il 7/12/2021 sono state 508 603 le somministrazioni di vaccino. Ad oggi in Italia abbiamo eseguito 99 792 722 dosi. Il 80.12% della popolazione ha ricevuto almeno una dose, e il 77.34% della popolazione ha ricevuto vaccinazione completa. 9609029 persone hanno ricevuto una dose aggiuntiva (16.22% della popolazione).
NB: queste percentuali variano, come vedrete nelle slide, se per valutare la copertura immunitaria efficace si considerano anche i 14 giorni necessari per lo sviluppo anticorpale dopo la somministrazione.",8,,,,,,
