Title,Image,Subtitle,Trend,Color,,,,,,
Aggiornamento,https://github.com/Paulsword/PilloleOttimismo/raw/main/Cover0.jpg,4 ottobre 2021,,1,,,,,,
Incidenza,https://github.com/Paulsword/PilloleOttimismo/raw/main/Cover1.jpg,35.9,"L'INCIDENZA su base nazionale è al momento pari a 35.9 nuovi positivi ogni 100.000 abitanti in 7 giorni (ieri era 36.2). Le Regioni con i valori più elevati sono Bolzano, con 74.4 casi, Sicilia (57), Basilicata (56.2), e Veneto (48.5). L'incidenza più bassa è in Molise, con 6.7 casi.",2,,,,,,
Variazione,https://github.com/Paulsword/PilloleOttimismo/raw/main/Cover2.jpg,-9.6%,"La VARIAZIONE PERCENTUALE dei nuovi casi negli ultimi sette giorni, rispetto ai sette precedenti, è stata pari a -9.6% (ieri era -11.5%, il giorno prima -13.6%, prima ancora -16.3%, -17.2%, -19.4%, -19.2%). I valori più elevati tra le Regioni si riscontrano in Valle d'Aosta (+81.5% negli ultimi sette giorni rispetto ai sette precedenti), Basilicata (+65.6%), Trento (+21%), Bolzano (+15.1%), Liguria (+10.7%), Sardegna (+7%), Friuli VG (+1%), Lazio (-5%), Emilia Romagna (-6.1%).",3,,,,,,
Nuovi casi,https://github.com/Paulsword/PilloleOttimismo/raw/main/Cover3.jpg,1612,"Sono 1612 i nuovi positivi registrati oggi, su 122214 tamponi (1.3%) e 95479 persone testate (1.69%).
Negli ultimi sette giorni abbiamo avuto in media 3041 nuovi positivi al giorno, ossia -323 casi al giorno rispetto ai sette giorni precedenti (ieri era -397).",4,,,,,,
Ricoveri,https://github.com/Paulsword/PilloleOttimismo/raw/main/Cover6.jpg,+41,"Abbiamo attualmente 3032 pazienti RICOVERATI IN REPARTO, pari al 5.3% dei posti letto disponibili (fonte: AGENAS). Negli ultimi 7 giorni la variazione media del numero di pazienti ricoverati è stata pari a -65 pazienti al giorno (era -71 nei sette giorni precedenti). La variazione percentuale complessiva sul totale dei pazienti ricoverati in questi sette giorni è stata -13%",5,,,,,,
TI,https://github.com/Paulsword/PilloleOttimismo/raw/main/Cover5.jpg,+6,"Oggi in TERAPIA INTENSIVA saldo di +6 pazienti (22 ingressi e 16 uscite). La variazione del totale degli INGRESSI in TI negli ultimi sette giorni, rispetto ai sette giorni precedenti, è stata del -28.2% (ieri era -22.2%, il giorno prima -27.8%).
I pazienti in TI sono complessivamente 437, pari al 4.8% dei posti letto attualmente disponibili. Negli ultimi sette giorni la variazione percentuale complessiva è stata -10.5%",6,,,,,,
Decessi,https://github.com/Paulsword/PilloleOttimismo/raw/main/Cover7.jpg,37,"In media abbiamo registrato in Italia 47 DECESSI al giorno negli ultimi sette giorni, e 55 nei sette giorni precedenti. La variazione dei decessi in questi ultimi sette giorni, rispetto ai sette precedenti, è stata pari a -16% (ieri era -13.7%, il giorno prima -6.5%, prima ancora 0%, -3.6%, -1.5%, -2%). Si ricordi tuttavia che molti decessi registrati risalgono alle settimane o ai mesi precedenti.",7,,,,,,
Vaccini,https://github.com/Paulsword/PilloleOttimismo/raw/main/Cover8.jpg,666 31,"Il 3/10/2021 sono state 666 31 le somministrazioni di vaccino. Ad oggi in Italia abbiamo eseguito 85 190 263 dosi. Il 76.57% della popolazione ha ricevuto almeno una dose, e il 72.13% della popolazione ha ricevuto vaccinazione completa. 96517 persone hanno ricevuto una dose aggiuntiva (0.16% della popolazione).",8,,,,,,
