Title,Image,Subtitle,Trend,Color,,,,,,
Aggiornamento,https://github.com/Paulsword/PilloleOttimismo/raw/main/Cover0.jpg,18 aprile 2021,,1,,,,,,
Incidenza,https://github.com/Paulsword/PilloleOttimismo/raw/main/Cover1.jpg,168,"L'INCIDENZA su base nazionale è al momento pari a 168 nuovi positivi ogni 100.000 abitanti in 7 giorni. Le Regioni con i valori più elevati sono Valle d'Aosta, con 249 casi, seguono Puglia (245), Campania (234), e Basilicata (221). L'incidenza più bassa è in Bolzano, con 71 casi.
Nei grafici trovate i valori di incidenza dei Paesi d'Europa, calcolati su 14 giorni.",2,,,,,,
Variazione,https://github.com/Paulsword/PilloleOttimismo/raw/main/Cover2.jpg,-1.2%,"La VARIAZIONE PERCENTUALE dei nuovi casi negli ultimi sette giorni, rispetto ai sette precedenti, è stata pari a -1.2% (ieri era -0.4%, il giorno prima -1.8%, prima ancora -1.8%, -7%, -15.4%, -24.9%). I valori più elevati tra le Regioni si riscontrano in Molise (+45.3% negli ultimi sette giorni rispetto ai sette precedenti), Basilicata (+26.6%), Campania (+19.3%), Calabria (+19.1%), Sicilia (+15.3%), Sardegna (+14.2%), Puglia (+3.9%), Toscana (-1.3%), Trento (-1.7%).",3,,,,,,
Nuovi casi,https://github.com/Paulsword/PilloleOttimismo/raw/main/Cover3.jpg,12694,"Sono 12694 i nuovi positivi registrati oggi, su 230116 tamponi (5.5%) e 81308 persone testate (15.61%).
Negli ultimi sette giorni abbiamo avuto in media 14332 nuovi positivi al giorno, ossia -174 casi al giorno rispetto ai sette giorni precedenti (ieri era -66).",4,,,,,,
Ricoveri,https://github.com/Paulsword/PilloleOttimismo/raw/main/Cover6.jpg,-452,"Abbiamo attualmente 23648 pazienti RICOVERATI IN REPARTO, pari al 36% dei posti letto disponibili (fonte: AGENAS). Negli ultimi 7 giorni la variazione media del numero di pazienti ricoverati è stata pari a -515 pazienti al giorno (era -169 nei sette giorni precedenti). La variazione percentuale complessiva sul totale dei pazienti ricoverati in questi sette giorni è stata -13.2%",5,,,,,,
TI,https://github.com/Paulsword/PilloleOttimismo/raw/main/Cover5.jpg,-29,"Oggi in TERAPIA INTENSIVA saldo di -29 pazienti (163 ingressi e 192 uscite). La variazione del totale degli INGRESSI in TI negli ultimi sette giorni, rispetto ai sette giorni precedenti, è stata del -9.3% (ieri era -9.7%, il giorno prima -11%).
I pazienti in TI sono complessivamente 3311, pari al 36% dei posti letto attualmente disponibili. Negli ultimi sette giorni la variazione percentuale complessiva è stata -7.6%",6,,,,,,
Decessi,https://github.com/Paulsword/PilloleOttimismo/raw/main/Cover7.jpg,251,"In media abbiamo avuto in Italia 382 DECESSI al giorno negli ultimi sette giorni, e 426 nei sette giorni precedenti. La variazione dei decessi in questi ultimi sette giorni, rispetto ai sette precedenti, è stata pari a -10.3% (ieri era -7.6%, il giorno prima -7.5%, prima ancora -7.1%, -3.9%, +7%, +1.4%).",7,,,,,,
Vaccini,https://github.com/Paulsword/PilloleOttimismo/raw/main/Cover8.jpg,15 168 276,"Ad oggi in Italia abbiamo eseguito 15168276 dosi di vaccino. 10710197 persone, pari al 17.96% della popolazione, hanno ricevuto la prima dose, e 4458079 persone, pari al 7.47% della popolazione, hanno ricevuto anche la seconda dose.",8,,,,,,
Zone rosse,https://github.com/Paulsword/PilloleOttimismo/raw/main/Cover9.jpg,13,"Delle attuali 13 Province in fascia rossa, 9 (pari a 3288856 persone) hanno un'incidenza al di sotto dei 250 casi settimanali ogni 100.000 abitanti. Qui proponiamo un modello su base provinciale e con soglia di incidenza rigorosamente correlata alla ricettività ospedaliera. Al momento, 63 Province al di sotto di quella soglia sono in regime di restrizione, e 4 di queste sono in fascia rossa.  Viceversa, 35 Province che secondo il nostro modello sono sopra-soglia, si trovano invece in arancione.",9,,,,,,
