Title,Image,Subtitle,Trend,Color,,,,,,
Aggiornamento,https://github.com/Paulsword/PilloleOttimismo/raw/main/Cover0.jpg,15 giugno 2021,,1,,,,,,
Incidenza,https://github.com/Paulsword/PilloleOttimismo/raw/main/Cover1.jpg,19,"L'INCIDENZA su base nazionale è al momento pari a 19 nuovi positivi ogni 100.000 abitanti in 7 giorni. Le Regioni con i valori più elevati sono Sicilia, con 35 casi, seguono Basilicata (34), Calabria (28), e Toscana (23). L'incidenza più bassa è in Liguria, con 7 casi.
Nei grafici trovate i valori di incidenza dei Paesi d'Europa, calcolati su 14 giorni.",2,,,,,,
Variazione,https://github.com/Paulsword/PilloleOttimismo/raw/main/Cover2.jpg,-25.2%,"La VARIAZIONE PERCENTUALE dei nuovi casi negli ultimi sette giorni, rispetto ai sette precedenti, è stata pari a -25.2% (ieri era -23.9%, il giorno prima -24.2%, prima ancora -22%, -22%, -23.4%, -31.7%). I valori più elevati tra le Regioni si riscontrano in Molise (+15.4% negli ultimi sette giorni rispetto ai sette precedenti), Basilicata (-0.5%), Puglia (-5.3%), Sicilia (-10.4%), Toscana (-20.7%), Sardegna (-21.5%), Lazio (-21.7%), Trento (-23.1%), Abruzzo (-23.8%).",3,,,,,,
Nuovi casi,https://github.com/Paulsword/PilloleOttimismo/raw/main/Cover3.jpg,1255,"Sono 1255 i nuovi positivi registrati oggi, su 212708 tamponi (0.6%) e 55507 persone testate (2.26%).
Negli ultimi sette giorni abbiamo avuto in media 1634 nuovi positivi al giorno, ossia -550 casi al giorno rispetto ai sette giorni precedenti (ieri era -542).",4,,,,,,
Ricoveri,https://github.com/Paulsword/PilloleOttimismo/raw/main/Cover6.jpg,-132,"Abbiamo attualmente 3333 pazienti RICOVERATI IN REPARTO, pari al 6% dei posti letto disponibili (fonte: AGENAS). Negli ultimi 7 giorni la variazione media del numero di pazienti ricoverati è stata pari a -193 pazienti al giorno (era -215 nei sette giorni precedenti). La variazione percentuale complessiva sul totale dei pazienti ricoverati in questi sette giorni è stata -28.9%",5,,,,,,
TI,https://github.com/Paulsword/PilloleOttimismo/raw/main/Cover5.jpg,-32,"Oggi in TERAPIA INTENSIVA saldo di -32 pazienti (26 ingressi e 58 uscite). La variazione del totale degli INGRESSI in TI negli ultimi sette giorni, rispetto ai sette giorni precedenti, è stata del -2.5% (ieri era -20%, il giorno prima -18.2%).
I pazienti in TI sono complessivamente 504, pari al 6% dei posti letto attualmente disponibili. Negli ultimi sette giorni la variazione percentuale complessiva è stata -26.7%",6,,,,,,
Decessi,https://github.com/Paulsword/PilloleOttimismo/raw/main/Cover7.jpg,63,"In media abbiamo avuto in Italia 59 DECESSI al giorno negli ultimi sette giorni, e 67 nei sette giorni precedenti. La variazione dei decessi in questi ultimi sette giorni, rispetto ai sette precedenti, è stata pari a -12.4% (ieri era -2.2%, il giorno prima +0.4%, prima ancora +7.2%, +2.6%, -6.6%, -26.8%).",7,,,,,,
Vaccini,https://github.com/Paulsword/PilloleOttimismo/raw/main/Cover8.jpg,516 321,"Il 14/6/2021 sono state 516 321 le somministrazioni di vaccino. Ad oggi in Italia abbiamo eseguito 42 893 655 dosi. Il 50.14% della popolazione ha ricevuto almeno una dose, e il 24.18% della popolazione ha ricevuto vaccinazione completa.",8,,,,,,
