Title,Image,Subtitle,Trend,Color,,,,,,
Aggiornamento,https://github.com/Paulsword/PilloleOttimismo/raw/main/Cover0.jpg,17 febbraio 2021,,1,,,,,,
Incidenza,https://github.com/Paulsword/PilloleOttimismo/raw/main/Cover1.jpg,138,"L'INCIDENZA su base nazionale è al momento pari a 138 nuovi positivi ogni 100.000 abitanti in 7 giorni. Le Regioni con i valori più elevati sono Bolzano, con 669 casi, seguono Trento (262), Umbria (258), e Abruzzo (235). L'incidenza più bassa è in Sardegna, con 37 casi.
Nei grafici trovate i valori di incidenza dei Paesi d'Europa, calcolati su 14 giorni.",2,,,,,,
Variazione,https://github.com/Paulsword/PilloleOttimismo/raw/main/Cover2.jpg,-1.3%,"La VARIAZIONE PERCENTUALE dei nuovi casi negli ultimi sette giorni, rispetto ai sette precedenti, è stata pari a -1.3% (ieri era -0.5%, il giorno prima +0.9%, prima ancora +1.7%, +2.9%, +3.7%, +4.9%). I valori più elevati tra le Regioni si riscontrano in Abruzzo (+24.2% negli ultimi sette giorni rispetto ai sette precedenti), Piemonte (+13.8%), Lombardia (+13%), Emilia Romagna (+6.7%), Toscana (+6%), Marche (+3.7%), Basilicata (+1.9%), Trento (-0.7%), Lazio (-2.2%).",3,,,,,,
Nuovi casi,https://github.com/Paulsword/PilloleOttimismo/raw/main/Cover3.jpg,12074,"Sono 12074 i nuovi positivi registrati oggi, su 294411 tamponi (4.1%) e 95408 persone testate (12.66%).
Negli ultimi sette giorni abbiamo avuto in media 11914 nuovi positivi al giorno, ossia -153 casi al giorno rispetto ai sette giorni precedenti (ieri era -62).",4,,,,,,
Ricoveri,https://github.com/Paulsword/PilloleOttimismo/raw/main/Cover6.jpg,-189,"Abbiamo attualmente 18274 pazienti RICOVERATI IN REPARTO, pari al 29% dei posti letto disponibili (fonte: AGENAS). Negli ultimi 7 giorni la variazione media del numero di pazienti ricoverati è stata pari a -144 pazienti al giorno (era -113 nei sette giorni precedenti). La variazione percentuale complessiva sul totale dei pazienti ricoverati in questi sette giorni è stata -5.2%",5,,,,,,
TI,https://github.com/Paulsword/PilloleOttimismo/raw/main/Cover5.jpg,-31,"Oggi in TERAPIA INTENSIVA saldo di -31 pazienti (113 ingressi e 144 uscite). La variazione del totale degli INGRESSI in TI negli ultimi sette giorni, rispetto ai sette giorni precedenti, è stata del -3.2% (ieri era +3.5%, il giorno prima +1.4%).
I pazienti in TI sono complessivamente 2043, pari al 23% dei posti letto attualmente disponibili. Negli ultimi sette giorni la variazione percentuale complessiva è stata -4%",6,,,,,,
Decessi,https://github.com/Paulsword/PilloleOttimismo/raw/main/Cover7.jpg,369,"In media abbiamo avuto in Italia 315 DECESSI al giorno negli ultimi sette giorni, e 360 nei sette giorni precedenti. La variazione dei decessi in questi ultimi sette giorni, rispetto ai sette precedenti, è stata pari a -12.6% (ieri era -18.4%, il giorno prima -17.6%, prima ancora -16.4%, -13.6%, -12.1%, -13%).",7,,,,,,
Vaccini,https://github.com/Paulsword/PilloleOttimismo/raw/main/Cover8.jpg,3146842,"Ad oggi in Italia abbiamo eseguito 3146842 dosi di vaccino. 1847998 persone, pari al 3.06% della popolazione, hanno ricevuto la prima dose, e 1298844 persone, pari al 2.15% della popolazione, hanno ricevuto anche la seconda dose.",8,,,,,,
