Title,Image,Subtitle,Trend,Color,,,,,,
Aggiornamento,https://github.com/Paulsword/PilloleOttimismo/raw/main/Cover0.jpg,5 gennaio 2022,,1,,,,,,
Incidenza,https://github.com/Paulsword/PilloleOttimismo/raw/main/Cover1.jpg,1521,"L'INCIDENZA su base nazionale è al momento pari a 1521 nuovi positivi ogni 100.000 abitanti in 7 giorni (ieri era 1368). Le Regioni con i valori più elevati sono Toscana, con 2640 casi, Lombardia (2442), Umbria (2250), e Valle d'Aosta (2049). L'incidenza più bassa è in Sardegna, con 401 casi.",2,,,,,,
Variazione,https://github.com/Paulsword/PilloleOttimismo/raw/main/Cover2.jpg,+135.9%,"La VARIAZIONE PERCENTUALE dei nuovi casi negli ultimi sette giorni, rispetto ai sette precedenti, è stata pari a +135.9% (ieri era +153%, il giorno prima +163.1%, prima ancora +163.6%, +150.2%, +141.6%, +122.4%). I valori più elevati tra le Regioni si riscontrano in Abruzzo (+490.6% negli ultimi sette giorni rispetto ai sette precedenti), Molise (+391.5%), Toscana (+255.7%), Emilia Romagna (+194.9%), Puglia (+193.4%), Trento (+176.8%), Friuli VG (+165.5%), Lazio (+146.8%), Valle d'Aosta (+141.1%).",3,,,,,,
Nuovi casi,https://github.com/Paulsword/PilloleOttimismo/raw/main/Cover3.jpg,189109,"Sono 189109 i nuovi positivi registrati oggi, su 1094255 tamponi (17.3%).
Negli ultimi sette giorni abbiamo avuto in media 128783 nuovi positivi al giorno, ossia +74198 casi al giorno rispetto ai sette giorni precedenti (ieri era +70006).",4,,,,,,
Ricoveri,https://github.com/Paulsword/PilloleOttimismo/raw/main/Cover6.jpg,+452,"Abbiamo attualmente 13364 pazienti RICOVERATI IN REPARTO, pari al 20.9% dei posti letto disponibili (fonte: AGENAS). Negli ultimi 7 giorni la variazione media del numero di pazienti ricoverati è stata pari a +398 pazienti al giorno (era +291 nei sette giorni precedenti). La variazione percentuale complessiva sul totale dei pazienti ricoverati in questi sette giorni è stata +26.3%",5,,,,,,
TI,https://github.com/Paulsword/PilloleOttimismo/raw/main/Cover5.jpg,+36,"Oggi in TERAPIA INTENSIVA saldo di +36 pazienti (132 ingressi e 96 uscite). La variazione del totale degli INGRESSI in TI negli ultimi sette giorni, rispetto ai sette giorni precedenti, è stata del +20.4% (ieri era +25.4%, il giorno prima +24.6%).
I pazienti in TI sono complessivamente 1428, pari al 15.5% dei posti letto attualmente disponibili. Negli ultimi sette giorni la variazione percentuale complessiva è stata +20.5%",6,,,,,,
Decessi,https://github.com/Paulsword/PilloleOttimismo/raw/main/Cover7.jpg,231,"In media abbiamo registrato in Italia 169 DECESSI al giorno negli ultimi sette giorni, e 145 nei sette giorni precedenti. La variazione dei decessi in questi ultimi sette giorni, rispetto ai sette precedenti, è stata pari a +16.9% (ieri era +8.9%, il giorno prima +5.9%, prima ancora +6.7%, -0.3%, +5.3%, +6.1%). Si ricordi tuttavia che molti decessi registrati risalgono alle settimane o ai mesi precedenti.",7,,,,,,
Vaccini,https://github.com/Paulsword/PilloleOttimismo/raw/main/Cover8.jpg,661 373,"Il 4/1/2022 sono state 661 373 le somministrazioni di vaccino. Ad oggi in Italia abbiamo eseguito 113 351 650 dosi. Il 82.02% della popolazione ha ricevuto almeno una dose, e il 78.51% della popolazione ha ricevuto vaccinazione completa. 21544385 persone hanno ricevuto una dose aggiuntiva (36.36% della popolazione).
NB: queste percentuali variano, come vedrete nelle slide, se per valutare la copertura immunitaria efficace si considerano anche i 14 giorni necessari per lo sviluppo anticorpale dopo la somministrazione.",8,,,,,,
