Title,Image,Subtitle,Trend,Color,,,,,,
Aggiornamento,https://github.com/Paulsword/PilloleOttimismo/raw/main/Cover0.jpg,24 gennaio 2022,,1,,,,,,
Incidenza,https://github.com/Paulsword/PilloleOttimismo/raw/main/Cover1.jpg,1963,"L'INCIDENZA su base nazionale è al momento pari a 1963 nuovi positivi ogni 100.000 abitanti in 7 giorni (ieri era 1977). Le Regioni con i valori più elevati sono Bolzano, con 3545 casi, Trento (2983), Emilia Romagna (2959), e Liguria (2684). L'incidenza più bassa è in Sardegna, con 556 casi.",2,,,,,,
Variazione,https://github.com/Paulsword/PilloleOttimismo/raw/main/Cover2.jpg,-5.5%,"La VARIAZIONE PERCENTUALE dei nuovi casi negli ultimi sette giorni, rispetto ai sette precedenti, è stata pari a -5.5% (ieri era -6.4%, il giorno prima -6%, prima ancora -6.5%, +0.3%, -2.5%, -1.4%). I valori più elevati tra le Regioni si riscontrano in Marche (+73.8% negli ultimi sette giorni rispetto ai sette precedenti), Basilicata (+58.1%), Friuli VG (+16.7%), Bolzano (+16.2%), Lazio (+11.9%), Veneto (+9.1%), Trento (+8.1%), Emilia Romagna (+4.9%), Liguria (+3.6%).",3,,,,,,
Nuovi casi,https://github.com/Paulsword/PilloleOttimismo/raw/main/Cover3.jpg,77696,"Sono 77696 i nuovi positivi registrati oggi, su 519293 tamponi (15%).
Negli ultimi sette giorni abbiamo avuto in media 166158 nuovi positivi al giorno, ossia -9583 casi al giorno rispetto ai sette giorni precedenti (ieri era -11362).",4,,,,,,
Ricoveri,https://github.com/Paulsword/PilloleOttimismo/raw/main/Cover6.jpg,+235,"Abbiamo attualmente 19862 pazienti RICOVERATI IN REPARTO, pari al 30.4% dei posti letto disponibili (fonte: AGENAS). Negli ultimi 7 giorni la variazione media del numero di pazienti ricoverati è stata pari a +91 pazienti al giorno (era +413 nei sette giorni precedenti). La variazione percentuale complessiva sul totale dei pazienti ricoverati in questi sette giorni è stata +3.3%",5,,,,,,
TI,https://github.com/Paulsword/PilloleOttimismo/raw/main/Cover5.jpg,0,"Oggi in TERAPIA INTENSIVA saldo di 0 pazienti (101 ingressi e 101 uscite). La variazione del totale degli INGRESSI in TI negli ultimi sette giorni, rispetto ai sette giorni precedenti, è stata del -8.1% (ieri era -5.3%, il giorno prima -7%).
I pazienti in TI sono complessivamente 1685, pari al 17.5% dei posti letto attualmente disponibili. Negli ultimi sette giorni la variazione percentuale complessiva è stata -1.9%",6,,,,,,
Decessi,https://github.com/Paulsword/PilloleOttimismo/raw/main/Cover7.jpg,352,"In media abbiamo registrato in Italia 355 DECESSI al giorno negli ultimi sette giorni, e 304 nei sette giorni precedenti. La variazione dei decessi in questi ultimi sette giorni, rispetto ai sette precedenti, è stata pari a +16.8% (ieri era +17.1%, il giorno prima +23.5%, prima ancora +30.5%, +40.1%, +46.2%, +49.7%). Si ricordi tuttavia che molti decessi registrati risalgono alle settimane o ai mesi precedenti.",7,,,,,,
Vaccini,https://github.com/Paulsword/PilloleOttimismo/raw/main/Cover8.jpg,333 556,"Il 23/1/2022 sono state 333 556 le somministrazioni di vaccino. Ad oggi in Italia abbiamo eseguito 124 416 045 dosi. Il 84.07% della popolazione ha ricevuto almeno una dose, e il 79.89% della popolazione ha ricevuto vaccinazione completa. 30231332 persone hanno ricevuto una dose aggiuntiva (51.02% della popolazione).
NB: queste percentuali variano, come vedrete nelle slide, se per valutare la copertura immunitaria efficace si considerano anche i 14 giorni necessari per lo sviluppo anticorpale dopo la somministrazione.",8,,,,,,
