Title,Image,Subtitle,Trend,Color,,,,,,
Aggiornamento,https://github.com/Paulsword/PilloleOttimismo/raw/main/Cover0.jpg,23 luglio 2021,,1,,,,,,
Incidenza,https://github.com/Paulsword/PilloleOttimismo/raw/main/Cover1.jpg,44.4,"L'INCIDENZA su base nazionale è al momento pari a 44.4 nuovi positivi ogni 100.000 abitanti in 7 giorni. Le Regioni con i valori più elevati sono Sardegna, con 90.4 casi, seguono Lazio (76), Veneto (73.9), e Sicilia (67). L'incidenza più bassa è in Piemonte, con 16.6 casi.
Nei grafici trovate i valori di incidenza dei Paesi d'Europa, calcolati su 14 giorni.",2,,,,,,
Variazione,https://github.com/Paulsword/PilloleOttimismo/raw/main/Cover2.jpg,+107.2%,"La VARIAZIONE PERCENTUALE dei nuovi casi negli ultimi sette giorni, rispetto ai sette precedenti, è stata pari a +107.2% (ieri era +115.1%, il giorno prima +111.9%, prima ancora +115.4%, +107.4%, +103.1%, +95.6%). I valori più elevati tra le Regioni si riscontrano in Umbria (+238.3% negli ultimi sette giorni rispetto ai sette precedenti), Valle d'Aosta (+200%), Toscana (+195.4%), Liguria (+185.3%), Basilicata (+181%), Lazio (+158.5%), Emilia Romagna (+145%), Sardegna (+141.1%), Veneto (+121.9%).",3,,,,,,
Nuovi casi,https://github.com/Paulsword/PilloleOttimismo/raw/main/Cover3.jpg,5143,"Sono 5143 i nuovi positivi registrati oggi, su 237635 tamponi (2.2%) e 54047 persone testate (9.52%).
Negli ultimi sette giorni abbiamo avuto in media 3761 nuovi positivi al giorno, ossia +1946 casi al giorno rispetto ai sette giorni precedenti (ieri era +1840).",4,,,,,,
Ricoveri,https://github.com/Paulsword/PilloleOttimismo/raw/main/Cover6.jpg,+70,"Abbiamo attualmente 1304 pazienti RICOVERATI IN REPARTO, pari al 2.3% dei posti letto disponibili (fonte: AGENAS). Negli ultimi 7 giorni la variazione media del numero di pazienti ricoverati è stata pari a +31 pazienti al giorno (era -11 nei sette giorni precedenti). La variazione percentuale complessiva sul totale dei pazienti ricoverati in questi sette giorni è stata +19.9%",5,,,,,,
TI,https://github.com/Paulsword/PilloleOttimismo/raw/main/Cover5.jpg,-3,"Oggi in TERAPIA INTENSIVA saldo di -3 pazienti (10 ingressi e 13 uscite). La variazione del totale degli INGRESSI in TI negli ultimi sette giorni, rispetto ai sette giorni precedenti, è stata del +29.6% (ieri era +49%, il giorno prima +56.5%).
I pazienti in TI sono complessivamente 155, pari al 1.8% dei posti letto attualmente disponibili. Negli ultimi sette giorni la variazione percentuale complessiva è stata -3.7%",6,,,,,,
Decessi,https://github.com/Paulsword/PilloleOttimismo/raw/main/Cover7.jpg,17,"In media abbiamo registrato in Italia 12 DECESSI al giorno negli ultimi sette giorni, e 14 nei sette giorni precedenti. La variazione dei decessi in questi ultimi sette giorni, rispetto ai sette precedenti, è stata pari a -9.5% (ieri era -26.6%, il giorno prima -34.5%, prima ancora -26.9%, -20.4%, -27%, -26.7%). Si ricordi tuttavia che molti decessi registrati risalgono alle settimane o ai mesi precedenti.",7,,,,,,
Vaccini,https://github.com/Paulsword/PilloleOttimismo/raw/main/Cover8.jpg,582 387,"Il 22/7/2021 sono state 582 387 le somministrazioni di vaccino. Ad oggi in Italia abbiamo eseguito 64 122 110 dosi. Il 62.61% della popolazione ha ricevuto almeno una dose, e il 49.27% della popolazione ha ricevuto vaccinazione completa.",8,,,,,,
