Title,Image,Subtitle,Trend,Color,,,,,,
Aggiornamento,https://github.com/Paulsword/PilloleOttimismo/raw/main/Cover0.jpg,10 agosto 2021,,1,,,,,,
Incidenza,https://github.com/Paulsword/PilloleOttimismo/raw/main/Cover1.jpg,72.4,"L'INCIDENZA su base nazionale è al momento pari a 72.4 nuovi positivi ogni 100.000 abitanti in 7 giorni (ieri era 71). Le Regioni con i valori più elevati sono Sardegna, con 145.4 casi, Toscana (126.7), Sicilia (119.8), e Umbria (104.2). L'incidenza più bassa è in Molise, con 20.6 casi.",2,,,,,,
Variazione,https://github.com/Paulsword/PilloleOttimismo/raw/main/Cover2.jpg,+11.9%,"La VARIAZIONE PERCENTUALE dei nuovi casi negli ultimi sette giorni, rispetto ai sette precedenti, è stata pari a +11.9% (ieri era +10.7%, il giorno prima +8.3%, prima ancora +8.8%, +11.9%, +16.7%, +17.4%). I valori più elevati tra le Regioni si riscontrano in Puglia (+42% negli ultimi sette giorni rispetto ai sette precedenti), Calabria (+36.8%), Campania (+34.9%), Marche (+32.8%), Basilicata (+27.5%), Umbria (+26.9%), Sicilia (+25.4%), Valle d'Aosta (+19.6%), Abruzzo (+18.3%).",3,,,,,,
Nuovi casi,https://github.com/Paulsword/PilloleOttimismo/raw/main/Cover3.jpg,5636,"Sono 5636 i nuovi positivi registrati oggi, su 241766 tamponi (2.3%) e 56580 persone testate (9.96%).
Negli ultimi sette giorni abbiamo avuto in media 6125 nuovi positivi al giorno, ossia +650 casi al giorno rispetto ai sette giorni precedenti (ieri era +582).",4,,,,,,
Ricoveri,https://github.com/Paulsword/PilloleOttimismo/raw/main/Cover6.jpg,+94,"Abbiamo attualmente 2880 pazienti RICOVERATI IN REPARTO, pari al 5.2% dei posti letto disponibili (fonte: AGENAS). Negli ultimi 7 giorni la variazione media del numero di pazienti ricoverati è stata pari a +98 pazienti al giorno (era +84 nei sette giorni precedenti). La variazione percentuale complessiva sul totale dei pazienti ricoverati in questi sette giorni è stata +31.1%",5,,,,,,
TI,https://github.com/Paulsword/PilloleOttimismo/raw/main/Cover5.jpg,-1,"Oggi in TERAPIA INTENSIVA saldo di -1 pazienti (26 ingressi e 27 uscite). La variazione del totale degli INGRESSI in TI negli ultimi sette giorni, rispetto ai sette giorni precedenti, è stata del +28.6% (ieri era +38%, il giorno prima +42.3%).
I pazienti in TI sono complessivamente 322, pari al 3.7% dei posti letto attualmente disponibili. Negli ultimi sette giorni la variazione percentuale complessiva è stata +24.8%",6,,,,,,
Decessi,https://github.com/Paulsword/PilloleOttimismo/raw/main/Cover7.jpg,31,"In media abbiamo registrato in Italia 23 DECESSI al giorno negli ultimi sette giorni, e 17 nei sette giorni precedenti. La variazione dei decessi in questi ultimi sette giorni, rispetto ai sette precedenti, è stata pari a +31.7% (ieri era +31.6%, il giorno prima +33.6%, prima ancora +20.7%, +27.3%, +22.9%, +20%). Si ricordi tuttavia che molti decessi registrati risalgono alle settimane o ai mesi precedenti.",7,,,,,,
Vaccini,https://github.com/Paulsword/PilloleOttimismo/raw/main/Cover8.jpg,391 002,"Il 9/8/2021 sono state 391 002 le somministrazioni di vaccino. Ad oggi in Italia abbiamo eseguito 72 436 423 dosi. Il 67.46% della popolazione ha ricevuto almeno una dose, e il 58.84% della popolazione ha ricevuto vaccinazione completa.",8,,,,,,
