Title,Image,Subtitle,Trend,Color,,,,,,
Aggiornamento,https://github.com/Paulsword/PilloleOttimismo/raw/main/Cover0.jpg,30 luglio 2021,,1,,,,,,
Incidenza,https://github.com/Paulsword/PilloleOttimismo/raw/main/Cover1.jpg,60.7,"L'INCIDENZA su base nazionale è al momento pari a 60.7 nuovi positivi ogni 100.000 abitanti in 7 giorni. Le Regioni con i valori più elevati sono Sardegna, con 139.2 casi, seguono Toscana (101.3), Veneto (95.2), e Lazio (87.3). L'incidenza più bassa è in Molise, con 17.9 casi.
Nei grafici trovate i valori di incidenza dei Paesi d'Europa, calcolati su 14 giorni.",2,,,,,,
Variazione,https://github.com/Paulsword/PilloleOttimismo/raw/main/Cover2.jpg,+36.7%,"La VARIAZIONE PERCENTUALE dei nuovi casi negli ultimi sette giorni, rispetto ai sette precedenti, è stata pari a +36.7% (ieri era +43.3%, il giorno prima +55.5%, prima ancora +65.1%, +78.7%, +85.4%, +96.5%). I valori più elevati tra le Regioni si riscontrano in Calabria (+106.5% negli ultimi sette giorni rispetto ai sette precedenti), Friuli VG (+90.5%), Piemonte (+77.2%), Toscana (+76.4%), Umbria (+63.1%), Marche (+54.9%), Sardegna (+54%), Emilia Romagna (+53.2%), Puglia (+49.9%).",3,,,,,,
Nuovi casi,https://github.com/Paulsword/PilloleOttimismo/raw/main/Cover3.jpg,6619,"Sono 6619 i nuovi positivi registrati oggi, su 247486 tamponi (2.7%) e 55881 persone testate (11.84%).
Negli ultimi sette giorni abbiamo avuto in media 5141 nuovi positivi al giorno, ossia +1381 casi al giorno rispetto ai sette giorni precedenti (ieri era +1491).",4,,,,,,
Ricoveri,https://github.com/Paulsword/PilloleOttimismo/raw/main/Cover6.jpg,+82,"Abbiamo attualmente 1812 pazienti RICOVERATI IN REPARTO, pari al 3.3% dei posti letto disponibili (fonte: AGENAS). Negli ultimi 7 giorni la variazione media del numero di pazienti ricoverati è stata pari a +73 pazienti al giorno (era +31 nei sette giorni precedenti). La variazione percentuale complessiva sul totale dei pazienti ricoverati in questi sette giorni è stata +39%",5,,,,,,
TI,https://github.com/Paulsword/PilloleOttimismo/raw/main/Cover5.jpg,+7,"Oggi in TERAPIA INTENSIVA saldo di +7 pazienti (20 ingressi e 13 uscite). La variazione del totale degli INGRESSI in TI negli ultimi sette giorni, rispetto ai sette giorni precedenti, è stata del +61.4% (ieri era +41.1%, il giorno prima +31.9%).
I pazienti in TI sono complessivamente 201, pari al 2.4% dei posti letto attualmente disponibili. Negli ultimi sette giorni la variazione percentuale complessiva è stata +29.7%",6,,,,,,
Decessi,https://github.com/Paulsword/PilloleOttimismo/raw/main/Cover7.jpg,18,"In media abbiamo registrato in Italia 16 DECESSI al giorno negli ultimi sette giorni, e 12 nei sette giorni precedenti. La variazione dei decessi in questi ultimi sette giorni, rispetto ai sette precedenti, è stata pari a +27.9% (ieri era +36.3%, il giorno prima +41.9%, prima ancora +46.1%, +12.8%, -10.9%, -18.8%). Si ricordi tuttavia che molti decessi registrati risalgono alle settimane o ai mesi precedenti.",7,,,,,,
Vaccini,https://github.com/Paulsword/PilloleOttimismo/raw/main/Cover8.jpg,509 318,"Il 29/7/2021 sono state 509 318 le somministrazioni di vaccino. Ad oggi in Italia abbiamo eseguito 67 755 390 dosi. Il 64.32% della popolazione ha ricevuto almeno una dose, e il 53.86% della popolazione ha ricevuto vaccinazione completa.",8,,,,,,
