Title,Image,Subtitle,Trend,Color,,,,,,
Aggiornamento,https://github.com/Paulsword/PilloleOttimismo/raw/main/Cover0.jpg,22 ottobre 2021,,1,,,,,,
Incidenza,https://github.com/Paulsword/PilloleOttimismo/raw/main/Cover1.jpg,35.6,"L'INCIDENZA su base nazionale è al momento pari a 35.6 nuovi positivi ogni 100.000 abitanti in 7 giorni (ieri era 33.6). Le Regioni con i valori più elevati sono Bolzano, con 83.6 casi, Friuli VG (56.5), Veneto (49.1), e Umbria (43.7). L'incidenza più bassa è in Sardegna, con 8.3 casi.",2,,,,,,
Variazione,https://github.com/Paulsword/PilloleOttimismo/raw/main/Cover2.jpg,+22.6%,"La VARIAZIONE PERCENTUALE dei nuovi casi negli ultimi sette giorni, rispetto ai sette precedenti, è stata pari a +22.6% (ieri era +14%, il giorno prima +5.9%, prima ancora -1.9%, -2.8%, -3.8%, -8.2%). I valori più elevati tra le Regioni si riscontrano in Umbria (+133.3% negli ultimi sette giorni rispetto ai sette precedenti), Molise (+82.6%), Bolzano (+63.4%), Friuli VG (+53.5%), Puglia (+36.3%), Lombardia (+35.7%), Lazio (+34.6%), Campania (+29.3%), Trento (+27.4%).",3,,,,,,
Nuovi casi,https://github.com/Paulsword/PilloleOttimismo/raw/main/Cover3.jpg,3882,"Sono 3882 i nuovi positivi registrati oggi, su 487218 tamponi (0.8%) e 64137 persone testate (6.05%).
Negli ultimi sette giorni abbiamo avuto in media 3011 nuovi positivi al giorno, ossia +555 casi al giorno rispetto ai sette giorni precedenti (ieri era +349).",4,,,,,,
Ricoveri,https://github.com/Paulsword/PilloleOttimismo/raw/main/Cover6.jpg,+4,"Abbiamo attualmente 2443 pazienti RICOVERATI IN REPARTO, pari al 4.2% dei posti letto disponibili (fonte: AGENAS). Negli ultimi 7 giorni la variazione media del numero di pazienti ricoverati è stata pari a 0 pazienti al giorno (era -42 nei sette giorni precedenti). La variazione percentuale complessiva sul totale dei pazienti ricoverati in questi sette giorni è stata -0.1%",5,,,,,,
TI,https://github.com/Paulsword/PilloleOttimismo/raw/main/Cover5.jpg,-13,"Oggi in TERAPIA INTENSIVA saldo di -13 pazienti (22 ingressi e 35 uscite). La variazione del totale degli INGRESSI in TI negli ultimi sette giorni, rispetto ai sette giorni precedenti, è stata del +15.5% (ieri era +16.7%, il giorno prima +14.8%).
I pazienti in TI sono complessivamente 343, pari al 3.8% dei posti letto attualmente disponibili. Negli ultimi sette giorni la variazione percentuale complessiva è stata -3.9%",6,,,,,,
Decessi,https://github.com/Paulsword/PilloleOttimismo/raw/main/Cover7.jpg,39,"In media abbiamo registrato in Italia 37 DECESSI al giorno negli ultimi sette giorni, e 39 nei sette giorni precedenti. La variazione dei decessi in questi ultimi sette giorni, rispetto ai sette precedenti, è stata pari a -5.5% (ieri era 0%, il giorno prima +1.1%, prima ancora +1.9%, -6.4%, -11.1%, -12%). Si ricordi tuttavia che molti decessi registrati risalgono alle settimane o ai mesi precedenti.",7,,,,,,
Vaccini,https://github.com/Paulsword/PilloleOttimismo/raw/main/Cover8.jpg,101 373,"Il 21/10/2021 sono state 101 373 le somministrazioni di vaccino. Ad oggi in Italia abbiamo eseguito 88 447 979 dosi. Il 78.32% della popolazione ha ricevuto almeno una dose, e il 74.65% della popolazione ha ricevuto vaccinazione completa. 920003 persone hanno ricevuto una dose aggiuntiva (1.55% della popolazione).",8,,,,,,
