Title,Image,Subtitle,Trend,Color,,,,,,
Aggiornamento,https://github.com/Paulsword/PilloleOttimismo/raw/main/Cover0.jpg,1 luglio 2021,,1,,,,,,
Incidenza,https://github.com/Paulsword/PilloleOttimismo/raw/main/Cover1.jpg,8.6,"L'INCIDENZA su base nazionale è al momento pari a 8.6 nuovi positivi ogni 100.000 abitanti in 7 giorni. Le Regioni con i valori più elevati sono Sicilia, con 15.5 casi, seguono Basilicata (14.6), Abruzzo (14.1), e Campania (12.2). L'incidenza più bassa è in Liguria, con 4.2 casi.
Nei grafici trovate i valori di incidenza dei Paesi d'Europa, calcolati su 14 giorni.",2,,,,,,
Variazione,https://github.com/Paulsword/PilloleOttimismo/raw/main/Cover2.jpg,-20.6%,"La VARIAZIONE PERCENTUALE dei nuovi casi negli ultimi sette giorni, rispetto ai sette precedenti, è stata pari a -20.6% (ieri era -24.6%, il giorno prima -26.8%, prima ancora -28.9%, -31.2%, -34.3%, -34.1%). I valori più elevati tra le Regioni si riscontrano in Abruzzo (+22.3% negli ultimi sette giorni rispetto ai sette precedenti), Valle d'Aosta (+15.4%), Sardegna (+13.5%), Campania (+2.4%), Marche (0%), Friuli VG (-4.2%), Bolzano (-8.9%), Lombardia (-17.1%), Veneto (-18.3%).",3,,,,,,
Nuovi casi,https://github.com/Paulsword/PilloleOttimismo/raw/main/Cover3.jpg,882,"Sono 882 i nuovi positivi registrati oggi, su 188474 tamponi (0.5%) e 46220 persone testate (1.91%).
Negli ultimi sette giorni abbiamo avuto in media 727 nuovi positivi al giorno, ossia -189 casi al giorno rispetto ai sette giorni precedenti (ieri era -240).",4,,,,,,
Ricoveri,https://github.com/Paulsword/PilloleOttimismo/raw/main/Cover6.jpg,-61,"Abbiamo attualmente 1532 pazienti RICOVERATI IN REPARTO, pari al 2.7% dei posti letto disponibili (fonte: AGENAS). Negli ultimi 7 giorni la variazione media del numero di pazienti ricoverati è stata pari a -71 pazienti al giorno (era -123 nei sette giorni precedenti). La variazione percentuale complessiva sul totale dei pazienti ricoverati in questi sette giorni è stata -24.4%",5,,,,,,
TI,https://github.com/Paulsword/PilloleOttimismo/raw/main/Cover5.jpg,-18,"Oggi in TERAPIA INTENSIVA saldo di -18 pazienti (7 ingressi e 25 uscite). La variazione del totale degli INGRESSI in TI negli ultimi sette giorni, rispetto ai sette giorni precedenti, è stata del -23.5% (ieri era -19.7%, il giorno prima -25%).
I pazienti in TI sono complessivamente 229, pari al 2.7% dei posti letto attualmente disponibili. Negli ultimi sette giorni la variazione percentuale complessiva è stata -30.2%",6,,,,,,
Decessi,https://github.com/Paulsword/PilloleOttimismo/raw/main/Cover7.jpg,21,"In media abbiamo avuto in Italia 32 DECESSI al giorno negli ultimi sette giorni, e 25 nei sette giorni precedenti. La variazione dei decessi in questi ultimi sette giorni, rispetto ai sette precedenti, è stata pari a +30.8% (ieri era +27.5%, il giorno prima -0.5%, prima ancora -17.4%, -24.6%, -26%, -35.9%).",7,,,,,,
Vaccini,https://github.com/Paulsword/PilloleOttimismo/raw/main/Cover8.jpg,541 272,"Il 30/6/2021 sono state 541 272 le somministrazioni di vaccino. Ad oggi in Italia abbiamo eseguito 51 730 983 dosi. Il 57.57% della popolazione ha ricevuto almeno una dose, e il 31.81% della popolazione ha ricevuto vaccinazione completa.",8,,,,,,
