Title,Image,Subtitle,Trend,Color,,,,,,
Aggiornamento,https://github.com/Paulsword/PilloleOttimismo/raw/main/Cover0.jpg,17 luglio 2021,,1,,,,,,
Incidenza,https://github.com/Paulsword/PilloleOttimismo/raw/main/Cover1.jpg,24.3,"L'INCIDENZA su base nazionale è al momento pari a 24.3 nuovi positivi ogni 100.000 abitanti in 7 giorni. Le Regioni con i valori più elevati sono Sardegna, con 46.7 casi, seguono Sicilia (41), Veneto (38.8), e Lazio (35.1). L'incidenza più bassa è in Basilicata, con 8 casi.
Nei grafici trovate i valori di incidenza dei Paesi d'Europa, calcolati su 14 giorni.",2,,,,,,
Variazione,https://github.com/Paulsword/PilloleOttimismo/raw/main/Cover2.jpg,+95.6%,"La VARIAZIONE PERCENTUALE dei nuovi casi negli ultimi sette giorni, rispetto ai sette precedenti, è stata pari a +95.6% (ieri era +84%, il giorno prima +77.3%, prima ancora +74.6%, +61.4%, +56.5%, +51.6%). I valori più elevati tra le Regioni si riscontrano in Trento (+396% negli ultimi sette giorni rispetto ai sette precedenti), Sardegna (+276.8%), Molise (+214.3%), Veneto (+174.1%), Lazio (+167.1%), Valle d'Aosta (+150%), Umbria (+131.7%), Liguria (+124.3%), Lombardia (+109.6%).",3,,,,,,
Nuovi casi,https://github.com/Paulsword/PilloleOttimismo/raw/main/Cover3.jpg,3121,"Sono 3121 i nuovi positivi registrati oggi, su 244797 tamponi (1.3%) e 54371 persone testate (5.74%).
Negli ultimi sette giorni abbiamo avuto in media 2061 nuovi positivi al giorno, ossia +1007 casi al giorno rispetto ai sette giorni precedenti (ieri era +828).",4,,,,,,
Ricoveri,https://github.com/Paulsword/PilloleOttimismo/raw/main/Cover6.jpg,+23,"Abbiamo attualmente 1111 pazienti RICOVERATI IN REPARTO, pari al 2% dei posti letto disponibili (fonte: AGENAS). Negli ultimi 7 giorni la variazione media del numero di pazienti ricoverati è stata pari a -5 pazienti al giorno (era -35 nei sette giorni precedenti). La variazione percentuale complessiva sul totale dei pazienti ricoverati in questi sette giorni è stata -3.1%",5,,,,,,
TI,https://github.com/Paulsword/PilloleOttimismo/raw/main/Cover5.jpg,+1,"Oggi in TERAPIA INTENSIVA saldo di +1 pazienti (9 ingressi e 8 uscite). La variazione del totale degli INGRESSI in TI negli ultimi sette giorni, rispetto ai sette giorni precedenti, è stata del +14% (ieri era +17.4%, il giorno prima +19.5%).
I pazienti in TI sono complessivamente 162, pari al 1.8% dei posti letto attualmente disponibili. Negli ultimi sette giorni la variazione percentuale complessiva è stata +0.6%",6,,,,,,
Decessi,https://github.com/Paulsword/PilloleOttimismo/raw/main/Cover7.jpg,13,"In media abbiamo registrato in Italia 14 DECESSI al giorno negli ultimi sette giorni, e 19 nei sette giorni precedenti. La variazione dei decessi in questi ultimi sette giorni, rispetto ai sette precedenti, è stata pari a -26.7% (ieri era -32.6%, il giorno prima -24.3%, prima ancora -25.7%, -35.8%, -40%, -28.8%). Si ricordi tuttavia che molti decessi registrati risalgono alle settimane o ai mesi precedenti.",7,,,,,,
Vaccini,https://github.com/Paulsword/PilloleOttimismo/raw/main/Cover8.jpg,576 634,"Il 16/7/2021 sono state 576 634 le somministrazioni di vaccino. Ad oggi in Italia abbiamo eseguito 60 826 415 dosi. Il 61.4% della popolazione ha ricevuto almeno una dose, e il 44.77% della popolazione ha ricevuto vaccinazione completa.",8,,,,,,
