Title,Image,Subtitle,Trend,Color,,,,,,
Aggiornamento,https://github.com/Paulsword/PilloleOttimismo/raw/main/Cover0.jpg,20 ottobre 2021,,1,,,,,,
Incidenza,https://github.com/Paulsword/PilloleOttimismo/raw/main/Cover1.jpg,31.7,"L'INCIDENZA su base nazionale è al momento pari a 31.7 nuovi positivi ogni 100.000 abitanti in 7 giorni (ieri era 30.2). Le Regioni con i valori più elevati sono Bolzano, con 72.9 casi, Friuli VG (46.7), Veneto (46), e Toscana (38.8). L'incidenza più bassa è in Molise, con 7.1 casi.",2,,,,,,
Variazione,https://github.com/Paulsword/PilloleOttimismo/raw/main/Cover2.jpg,+5.9%,"La VARIAZIONE PERCENTUALE dei nuovi casi negli ultimi sette giorni, rispetto ai sette precedenti, è stata pari a +5.9% (ieri era -1.9%, il giorno prima -2.8%, prima ancora -3.8%, -8.2%, -12%, -12.2%). I valori più elevati tra le Regioni si riscontrano in Friuli VG (+36.3% negli ultimi sette giorni rispetto ai sette precedenti), Bolzano (+26.3%), Lazio (+23.9%), Lombardia (+22.8%), Piemonte (+19.3%), Umbria (+17.5%), Campania (+13.4%), Trento (+10.5%), Puglia (+6.6%).",3,,,,,,
Nuovi casi,https://github.com/Paulsword/PilloleOttimismo/raw/main/Cover3.jpg,3702,"Sono 3702 i nuovi positivi registrati oggi, su 485613 tamponi (0.8%) e 71756 persone testate (5.16%).
Negli ultimi sette giorni abbiamo avuto in media 2686 nuovi positivi al giorno, ossia +150 casi al giorno rispetto ai sette giorni precedenti (ieri era -48).",4,,,,,,
Ricoveri,https://github.com/Paulsword/PilloleOttimismo/raw/main/Cover6.jpg,+41,"Abbiamo attualmente 2464 pazienti RICOVERATI IN REPARTO, pari al 4.3% dei posti letto disponibili (fonte: AGENAS). Negli ultimi 7 giorni la variazione media del numero di pazienti ricoverati è stata pari a -13 pazienti al giorno (era -46 nei sette giorni precedenti). La variazione percentuale complessiva sul totale dei pazienti ricoverati in questi sette giorni è stata -3.4%",5,,,,,,
TI,https://github.com/Paulsword/PilloleOttimismo/raw/main/Cover5.jpg,0,"Oggi in TERAPIA INTENSIVA saldo di 0 pazienti (25 ingressi e 25 uscite). La variazione del totale degli INGRESSI in TI negli ultimi sette giorni, rispetto ai sette giorni precedenti, è stata del +14.8% (ieri era +6%, il giorno prima +3.8%).
I pazienti in TI sono complessivamente 355, pari al 3.9% dei posti letto attualmente disponibili. Negli ultimi sette giorni la variazione percentuale complessiva è stata -3.3%",6,,,,,,
Decessi,https://github.com/Paulsword/PilloleOttimismo/raw/main/Cover7.jpg,33,"In media abbiamo registrato in Italia 38 DECESSI al giorno negli ultimi sette giorni, e 38 nei sette giorni precedenti. La variazione dei decessi in questi ultimi sette giorni, rispetto ai sette precedenti, è stata pari a +1.1% (ieri era +1.9%, il giorno prima -6.4%, prima ancora -11.1%, -12%, +7.8%, -5.1%). Si ricordi tuttavia che molti decessi registrati risalgono alle settimane o ai mesi precedenti.",7,,,,,,
Vaccini,https://github.com/Paulsword/PilloleOttimismo/raw/main/Cover8.jpg,112 976,"Il 19/10/2021 sono state 112 976 le somministrazioni di vaccino. Ad oggi in Italia abbiamo eseguito 88 182 393 dosi. Il 78.24% della popolazione ha ricevuto almeno una dose, e il 74.46% della popolazione ha ricevuto vaccinazione completa. 809720 persone hanno ricevuto una dose aggiuntiva (1.37% della popolazione).",8,,,,,,
