Title,Image,Subtitle,Trend,Color,,,,,,
Aggiornamento,https://github.com/Paulsword/PilloleOttimismo/raw/main/Cover0.jpg,26 marzo 2021,,1,,,,,,
Incidenza,https://github.com/Paulsword/PilloleOttimismo/raw/main/Cover1.jpg,244,"L'INCIDENZA su base nazionale è al momento pari a 244 nuovi positivi ogni 100.000 abitanti in 7 giorni. Le Regioni con i valori più elevati sono Friuli VG, con 399 casi, seguono Piemonte (334), Emilia Romagna (332), e Puglia (302). L'incidenza più bassa è in Sardegna, con 71 casi.
Nei grafici trovate i valori di incidenza dei Paesi d'Europa, calcolati su 14 giorni.",2,,,,,,
Variazione,https://github.com/Paulsword/PilloleOttimismo/raw/main/Cover2.jpg,-7.2%,"La VARIAZIONE PERCENTUALE dei nuovi casi negli ultimi sette giorni, rispetto ai sette precedenti, è stata pari a -7.2% (ieri era -6.6%, il giorno prima -6.3%, prima ancora -4.8%, -3.3%, -1.6%, -0.4%). I valori più elevati tra le Regioni si riscontrano in Sardegna (+58.1% negli ultimi sette giorni rispetto ai sette precedenti), Valle d'Aosta (+31%), Liguria (+26.6%), Calabria (+20.8%), Sicilia (+13.2%), Puglia (+11.8%), Toscana (+1.9%), Veneto (-2.4%), Lazio (-3.5%).",3,,,,,,
Nuovi casi,https://github.com/Paulsword/PilloleOttimismo/raw/main/Cover3.jpg,23987,"Sono 23987 i nuovi positivi registrati oggi, su 354982 tamponi (6.8%) e 111080 persone testate (21.59%).
Negli ultimi sette giorni abbiamo avuto in media 20779 nuovi positivi al giorno, ossia -1610 casi al giorno rispetto ai sette giorni precedenti (ieri era -1488).",4,,,,,,
Ricoveri,https://github.com/Paulsword/PilloleOttimismo/raw/main/Cover6.jpg,+48,"Abbiamo attualmente 28472 pazienti RICOVERATI IN REPARTO, pari al 43% dei posti letto disponibili (fonte: AGENAS). Negli ultimi 7 giorni la variazione media del numero di pazienti ricoverati è stata pari a +231 pazienti al giorno (era +457 nei sette giorni precedenti). La variazione percentuale complessiva sul totale dei pazienti ricoverati in questi sette giorni è stata +6%",5,,,,,,
TI,https://github.com/Paulsword/PilloleOttimismo/raw/main/Cover5.jpg,+8,"Oggi in TERAPIA INTENSIVA saldo di +8 pazienti (288 ingressi e 280 uscite). La variazione del totale degli INGRESSI in TI negli ultimi sette giorni, rispetto ai sette giorni precedenti, è stata del -1.3% (ieri era -2.7%, il giorno prima -4.2%).
I pazienti in TI sono complessivamente 3628, pari al 40% dei posti letto attualmente disponibili. Negli ultimi sette giorni la variazione percentuale complessiva è stata +7.8%",6,,,,,,
Decessi,https://github.com/Paulsword/PilloleOttimismo/raw/main/Cover7.jpg,457,"In media abbiamo avuto in Italia 431 DECESSI al giorno negli ultimi sette giorni, e 382 nei sette giorni precedenti. La variazione dei decessi in questi ultimi sette giorni, rispetto ai sette precedenti, è stata pari a +12.6% (ieri era +10.2%, il giorno prima +10.9%, prima ancora +14.1%, +18.1%, +18.5%, +19.9%).",7,,,,,,
Vaccini,https://github.com/Paulsword/PilloleOttimismo/raw/main/Cover8.jpg,8959782,"Ad oggi in Italia abbiamo eseguito 8959782 dosi di vaccino. 6109713 persone, pari al 10.24% della popolazione, hanno ricevuto la prima dose, e 2850069 persone, pari al 4.78% della popolazione, hanno ricevuto anche la seconda dose.",8,,,,,,
