Title,Image,Subtitle,Trend,Color,,,,,,
Aggiornamento,https://github.com/Paulsword/PilloleOttimismo/raw/main/Cover0.jpg,15 maggio 2021,,1,,,,,,
Incidenza,https://github.com/Paulsword/PilloleOttimismo/raw/main/Cover1.jpg,85,"L'INCIDENZA su base nazionale è al momento pari a 85 nuovi positivi ogni 100.000 abitanti in 7 giorni. Le Regioni con i valori più elevati sono Campania, con 134 casi, seguono Valle d'Aosta (125), Basilicata (119), e Toscana (102). L'incidenza più bassa è in Molise, con 29 casi.
Nei grafici trovate i valori di incidenza dei Paesi d'Europa, calcolati su 14 giorni.",2,,,,,,
Variazione,https://github.com/Paulsword/PilloleOttimismo/raw/main/Cover2.jpg,-25%,"La VARIAZIONE PERCENTUALE dei nuovi casi negli ultimi sette giorni, rispetto ai sette precedenti, è stata pari a -25% (ieri era -23%, il giorno prima -22%, prima ancora -19.6%, -19%, -17.6%, -19.1%). I valori più elevati tra le Regioni si riscontrano in Bolzano (+0.2% negli ultimi sette giorni rispetto ai sette precedenti), Umbria (-6.6%), Basilicata (-10.2%), Marche (-13.2%), Abruzzo (-16.8%), Campania (-19.2%), Calabria (-20.5%), Piemonte (-21.6%), Trento (-21.7%).",3,,,,,,
Nuovi casi,https://github.com/Paulsword/PilloleOttimismo/raw/main/Cover3.jpg,6659,"Sono 6659 i nuovi positivi registrati oggi, su 294686 tamponi (2.3%) e 95627 persone testate (6.96%).
Negli ultimi sette giorni abbiamo avuto in media 7208 nuovi positivi al giorno, ossia -2407 casi al giorno rispetto ai sette giorni precedenti (ieri era -2303).",4,,,,,,
Ricoveri,https://github.com/Paulsword/PilloleOttimismo/raw/main/Cover6.jpg,-557,"Abbiamo attualmente 12493 pazienti RICOVERATI IN REPARTO, pari al 20% dei posti letto disponibili (fonte: AGENAS). Negli ultimi 7 giorni la variazione media del numero di pazienti ricoverati è stata pari a -472 pazienti al giorno (era -369 nei sette giorni precedenti). La variazione percentuale complessiva sul totale dei pazienti ricoverati in questi sette giorni è stata -20.9%",5,,,,,,
TI,https://github.com/Paulsword/PilloleOttimismo/raw/main/Cover5.jpg,-55,"Oggi in TERAPIA INTENSIVA saldo di -55 pazienti (63 ingressi e 118 uscite). La variazione del totale degli INGRESSI in TI negli ultimi sette giorni, rispetto ai sette giorni precedenti, è stata del -27.8% (ieri era -25.1%, il giorno prima -26.3%).
I pazienti in TI sono complessivamente 1805, pari al 20% dei posti letto attualmente disponibili. Negli ultimi sette giorni la variazione percentuale complessiva è stata -18.4%",6,,,,,,
Decessi,https://github.com/Paulsword/PilloleOttimismo/raw/main/Cover7.jpg,136,"In media abbiamo avuto in Italia 196 DECESSI al giorno negli ultimi sette giorni, e 237 nei sette giorni precedenti. La variazione dei decessi in questi ultimi sette giorni, rispetto ai sette precedenti, è stata pari a -17.6% (ieri era -12.4%, il giorno prima -13.8%, prima ancora -12%, -15.4%, -15.6%, -14.6%).",7,,,,,,
Vaccini,https://github.com/Paulsword/PilloleOttimismo/raw/main/Cover8.jpg,514 695,"Il 14/5/2021 sono state 514 695 le somministrazioni di vaccino. Ad oggi in Italia abbiamo eseguito 26 867 179 dosi. Il 31.48% della popolazione ha ricevuto almeno una dose, e il 14.23% della popolazione ha ricevuto vaccinazione completa.",8,,,,,,
Zone rosse,https://github.com/Paulsword/PilloleOttimismo/raw/main/Cover9.jpg,2,"Qui proponiamo un modello di monitoraggio su base provinciale e con soglia di incidenza correlata alla ricettività ospedaliera (slide 10 e 11). Al momento, 2 Province sono sopra quella soglia. Di queste, 0 sono realmente in fascia rossa, 0 sono in fascia arancione e 2 sono in fascia gialla. Viceversa, delle 105 Province per noi attualmente VERDI, perchè al di sotto di quella soglia, 1 si trovano in fascia arancione, 0 in rosso, 104 in giallo.",9,,,,,,
