Title,Image,Subtitle,Trend,Color,,,,,,
Aggiornamento,https://github.com/Paulsword/PilloleOttimismo/raw/main/Cover0.jpg,24 dicembre 2021,,1,,,,,,
Incidenza,https://github.com/Paulsword/PilloleOttimismo/raw/main/Cover1.jpg,389.4,"L'INCIDENZA su base nazionale è al momento pari a 389.4 nuovi positivi ogni 100.000 abitanti in 7 giorni (ieri era 352.4). Le Regioni con i valori più elevati sono Lombardia, con 621.2 casi, Veneto (599.6), Piemonte (489), e Umbria (483.8). L'incidenza più bassa è in Molise, con 82.6 casi.",2,,,,,,
Variazione,https://github.com/Paulsword/PilloleOttimismo/raw/main/Cover2.jpg,+52.2%,"La VARIAZIONE PERCENTUALE dei nuovi casi negli ultimi sette giorni, rispetto ai sette precedenti, è stata pari a +52.2% (ieri era +45.6%, il giorno prima +46.6%, prima ancora +42.2%, +39.7%, +40.6%, +41.3%). I valori più elevati tra le Regioni si riscontrano in Umbria (+158.5% negli ultimi sette giorni rispetto ai sette precedenti), Lombardia (+120.1%), Molise (+102.5%), Toscana (+98%), Campania (+79.6%), Basilicata (+69.4%), Piemonte (+67.1%), Puglia (+48.1%), Abruzzo (+39.2%).",3,,,,,,
Nuovi casi,https://github.com/Paulsword/PilloleOttimismo/raw/main/Cover3.jpg,50599,"Sono 50599 i nuovi positivi registrati oggi, su 929775 tamponi (5.4%) e 161804 persone testate (31.27%).
Negli ultimi sette giorni abbiamo avuto in media 32967 nuovi positivi al giorno, ossia +11308 casi al giorno rispetto ai sette giorni precedenti (ieri era +9342).",4,,,,,,
Ricoveri,https://github.com/Paulsword/PilloleOttimismo/raw/main/Cover6.jpg,+90,"Abbiamo attualmente 8812 pazienti RICOVERATI IN REPARTO, pari al 14% dei posti letto disponibili (fonte: AGENAS). Negli ultimi 7 giorni la variazione media del numero di pazienti ricoverati è stata pari a +185 pazienti al giorno (era +148 nei sette giorni precedenti). La variazione percentuale complessiva sul totale dei pazienti ricoverati in questi sette giorni è stata +17.2%",5,,,,,,
TI,https://github.com/Paulsword/PilloleOttimismo/raw/main/Cover5.jpg,+15,"Oggi in TERAPIA INTENSIVA saldo di +15 pazienti (102 ingressi e 87 uscite). La variazione del totale degli INGRESSI in TI negli ultimi sette giorni, rispetto ai sette giorni precedenti, è stata del +16.9% (ieri era +9.7%, il giorno prima +18.2%).
I pazienti in TI sono complessivamente 1038, pari al 11.4% dei posti letto attualmente disponibili. Negli ultimi sette giorni la variazione percentuale complessiva è stata +12.5%",6,,,,,,
Decessi,https://github.com/Paulsword/PilloleOttimismo/raw/main/Cover7.jpg,141,"In media abbiamo registrato in Italia 138 DECESSI al giorno negli ultimi sette giorni, e 107 nei sette giorni precedenti. La variazione dei decessi in questi ultimi sette giorni, rispetto ai sette precedenti, è stata pari a +28.3% (ieri era +25.9%, il giorno prima +27.3%, prima ancora +33%, +32.2%, +27.4%, +27.1%). Si ricordi tuttavia che molti decessi registrati risalgono alle settimane o ai mesi precedenti.",7,,,,,,
Vaccini,https://github.com/Paulsword/PilloleOttimismo/raw/main/Cover8.jpg,466 579,"Il 23/12/2021 sono state 466 579 le somministrazioni di vaccino. Ad oggi in Italia abbiamo eseguito 107 793 469 dosi. Il 81.14% della popolazione ha ricevuto almeno una dose, e il 77.96% della popolazione ha ricevuto vaccinazione completa. 16791194 persone hanno ricevuto una dose aggiuntiva (28.34% della popolazione).
NB: queste percentuali variano, come vedrete nelle slide, se per valutare la copertura immunitaria efficace si considerano anche i 14 giorni necessari per lo sviluppo anticorpale dopo la somministrazione.",8,,,,,,
