Title,Image,Subtitle,Trend,Color,,,,,,
Aggiornamento,https://github.com/Paulsword/PilloleOttimismo/raw/main/Cover0.jpg,8 ottobre 2021,,1,,,,,,
Incidenza,https://github.com/Paulsword/PilloleOttimismo/raw/main/Cover1.jpg,33,"L'INCIDENZA su base nazionale è al momento pari a 33 nuovi positivi ogni 100.000 abitanti in 7 giorni (ieri era 33.6). Le Regioni con i valori più elevati sono Bolzano, con 74.8 casi, Veneto (48.8), Sicilia (47.8), e Valle d'Aosta (46.8). L'incidenza più bassa è in Molise, con 12.1 casi.",2,,,,,,
Variazione,https://github.com/Paulsword/PilloleOttimismo/raw/main/Cover2.jpg,-10.3%,"La VARIAZIONE PERCENTUALE dei nuovi casi negli ultimi sette giorni, rispetto ai sette precedenti, è stata pari a -10.3% (ieri era -10.1%, il giorno prima -7.3%, prima ancora -10.4%, -9.6%, -11.5%, -13.6%). I valori più elevati tra le Regioni si riscontrano in Molise (+71.4% negli ultimi sette giorni rispetto ai sette precedenti), Valle d'Aosta (+41.5%), Trento (+24%), Bolzano (+6.7%), Veneto (+1.9%), Lazio (-1.1%), Campania (-4.4%), Marche (-7.2%), Friuli VG (-7.8%).",3,,,,,,
Nuovi casi,https://github.com/Paulsword/PilloleOttimismo/raw/main/Cover3.jpg,3023,"Sono 3023 i nuovi positivi registrati oggi, su 271566 tamponi (1.1%) e 52525 persone testate (5.76%).
Negli ultimi sette giorni abbiamo avuto in media 2791 nuovi positivi al giorno, ossia -319 casi al giorno rispetto ai sette giorni precedenti (ieri era -320).",4,,,,,,
Ricoveri,https://github.com/Paulsword/PilloleOttimismo/raw/main/Cover6.jpg,-82,"Abbiamo attualmente 2742 pazienti RICOVERATI IN REPARTO, pari al 4.8% dei posti letto disponibili (fonte: AGENAS). Negli ultimi 7 giorni la variazione media del numero di pazienti ricoverati è stata pari a -54 pazienti al giorno (era -62 nei sette giorni precedenti). La variazione percentuale complessiva sul totale dei pazienti ricoverati in questi sette giorni è stata -12.1%",5,,,,,,
TI,https://github.com/Paulsword/PilloleOttimismo/raw/main/Cover5.jpg,-20,"Oggi in TERAPIA INTENSIVA saldo di -20 pazienti (17 ingressi e 37 uscite). La variazione del totale degli INGRESSI in TI negli ultimi sette giorni, rispetto ai sette giorni precedenti, è stata del -7.3% (ieri era -13.3%, il giorno prima -14.1%).
I pazienti in TI sono complessivamente 383, pari al 4.2% dei posti letto attualmente disponibili. Negli ultimi sette giorni la variazione percentuale complessiva è stata -10.7%",6,,,,,,
Decessi,https://github.com/Paulsword/PilloleOttimismo/raw/main/Cover7.jpg,30,"In media abbiamo registrato in Italia 36 DECESSI al giorno negli ultimi sette giorni, e 53 nei sette giorni precedenti. La variazione dei decessi in questi ultimi sette giorni, rispetto ai sette precedenti, è stata pari a -31.1% (ieri era -25.1%, il giorno prima -24.9%, prima ancora -19.4%, -16%, -13.7%, -6.5%). Si ricordi tuttavia che molti decessi registrati risalgono alle settimane o ai mesi precedenti.",7,,,,,,
Vaccini,https://github.com/Paulsword/PilloleOttimismo/raw/main/Cover8.jpg,120 166,"Il 7/10/2021 sono state 120 166 le somministrazioni di vaccino. Ad oggi in Italia abbiamo eseguito 86 000 686 dosi. Il 77.05% della popolazione ha ricevuto almeno una dose, e il 72.78% della popolazione ha ricevuto vaccinazione completa. 268168 persone hanno ricevuto una dose aggiuntiva (0.45% della popolazione).",8,,,,,,
