Title,Image,Subtitle,Trend,Color,,,,,,
Aggiornamento,https://github.com/Paulsword/PilloleOttimismo/raw/main/Cover0.jpg,22 febbraio 2022,,1,,,,,,
Incidenza,https://github.com/Paulsword/PilloleOttimismo/raw/main/Cover1.jpg,588,"L'INCIDENZA su base nazionale è al momento pari a 588 nuovi positivi ogni 100.000 abitanti in 7 giorni (ieri era 607). Le Regioni con i valori più elevati sono Bolzano, con 889 casi, Marche (807), Abruzzo (799), e Basilicata (780). L'incidenza più bassa è in Valle d'Aosta, con 287 casi.",2,,,,,,
Variazione,https://github.com/Paulsword/PilloleOttimismo/raw/main/Cover2.jpg,-20.6%,"La VARIAZIONE PERCENTUALE dei nuovi casi negli ultimi sette giorni, rispetto ai sette precedenti, è stata pari a -20.6% (ieri era -23.6%, il giorno prima -24.7%, prima ancora -26.4%, -28.4%, -30.2%, -31.4%). I valori più elevati tra le Regioni si riscontrano in Calabria (-0.5% negli ultimi sette giorni rispetto ai sette precedenti), Basilicata (-7.4%), Abruzzo (-10.6%), Sicilia (-11%), Puglia (-14%), Lazio (-16.4%), Umbria (-16.8%), Campania (-19.8%), Veneto (-21.7%).",3,,,,,,
Nuovi casi,https://github.com/Paulsword/PilloleOttimismo/raw/main/Cover3.jpg,60029,"Sono 60029 i nuovi positivi registrati oggi, su 603639 tamponi (9.9%).
Negli ultimi sette giorni abbiamo avuto in media 49813 nuovi positivi al giorno, ossia -12918 casi al giorno rispetto ai sette giorni precedenti (ieri era -15832).",4,,,,,,
Ricoveri,https://github.com/Paulsword/PilloleOttimismo/raw/main/Cover6.jpg,-299,"Abbiamo attualmente 13076 pazienti RICOVERATI IN REPARTO, pari al 20% dei posti letto disponibili (fonte: AGENAS). Negli ultimi 7 giorni la variazione media del numero di pazienti ricoverati è stata pari a -361 pazienti al giorno (era -391 nei sette giorni precedenti). La variazione percentuale complessiva sul totale dei pazienti ricoverati in questi sette giorni è stata -16.2%",5,,,,,,
TI,https://github.com/Paulsword/PilloleOttimismo/raw/main/Cover5.jpg,-32,"Oggi in TERAPIA INTENSIVA saldo di -32 pazienti (82 ingressi e 114 uscite). La variazione del totale degli INGRESSI in TI negli ultimi sette giorni, rispetto ai sette giorni precedenti, è stata del -16.9% (ieri era -17.8%, il giorno prima -17.4%).
I pazienti in TI sono complessivamente 896, pari al 9.3% dei posti letto attualmente disponibili. Negli ultimi sette giorni la variazione percentuale complessiva è stata -19.9%",6,,,,,,
Decessi,https://github.com/Paulsword/PilloleOttimismo/raw/main/Cover7.jpg,322,"In media abbiamo registrato in Italia 261 DECESSI al giorno negli ultimi sette giorni, e 310 nei sette giorni precedenti. La variazione dei decessi in questi ultimi sette giorni, rispetto ai sette precedenti, è stata pari a -15.8% (ieri era -13.9%, il giorno prima -12%, prima ancora -11.3%, -14.5%, -17.1%, -19.8%). Si ricordi tuttavia che molti decessi registrati risalgono alle settimane o ai mesi precedenti.",7,,,,,,
Vaccini,https://github.com/Paulsword/PilloleOttimismo/raw/main/Cover8.jpg,131 969,"Il 21/2/2022 sono state 131 969 le somministrazioni di vaccino. Ad oggi in Italia abbiamo eseguito 133 340 780 dosi. Il 85.38% della popolazione ha ricevuto almeno una dose, e il 82.94% della popolazione ha ricevuto vaccinazione completa. 37039718 persone hanno ricevuto una dose aggiuntiva (62.51% della popolazione).
NB: queste percentuali variano, come vedrete nelle slide, se per valutare la copertura immunitaria efficace si considerano anche i 14 giorni necessari per lo sviluppo anticorpale dopo la somministrazione.",8,,,,,,
