Title,Image,Subtitle,Trend,Color,,,,,,
Aggiornamento,https://github.com/Paulsword/PilloleOttimismo/raw/main/Cover0.jpg,9 febbraio 2021,,1,,,,,,
Incidenza,https://github.com/Paulsword/PilloleOttimismo/raw/main/Cover1.jpg,140,"L'INCIDENZA su base nazionale è al momento pari a 140 nuovi positivi ogni 100.000 abitanti in 7 giorni. Le Regioni con i valori più elevati sono Bolzano, con 816 casi, seguono Umbria (292), Trento (256), e Friuli VG (213). L'incidenza più bassa è in Valle d'Aosta, con 53 casi.
Nei grafici trovate i valori di incidenza dei Paesi d'Europa, calcolati su 14 giorni.",2,,,,,,
Variazione,https://github.com/Paulsword/PilloleOttimismo/raw/main/Cover2.jpg,+0.1%,"La VARIAZIONE PERCENTUALE dei nuovi casi negli ultimi sette giorni, rispetto ai sette precedenti, è stata pari a +0.1% (ieri era -2.2%, il giorno prima -2.9%, prima ancora -3.8%, -5.3%, -6.1%, -5%). I valori più elevati tra le Regioni si riscontrano in Basilicata (+54.9% negli ultimi sette giorni rispetto ai sette precedenti), Campania (+25.8%), Umbria (+24.4%), Abruzzo (+24.2%), Toscana (+21.2%), Valle d'Aosta (+15.8%), Bolzano (+15.2%), Liguria (+12.7%), Molise (+9.7%).",3,,,,,,
Nuovi casi,https://github.com/Paulsword/PilloleOttimismo/raw/main/Cover3.jpg,10630,"Sono 10630 i nuovi positivi registrati oggi, su 274263 tamponi (3.9%) e 82716 persone testate (12.85%).
Negli ultimi sette giorni abbiamo avuto in media 12103 nuovi positivi al giorno, ossia +9 casi al giorno rispetto ai sette giorni precedenti (ieri era -263).",4,,,,,,
Ricoveri,https://github.com/Paulsword/PilloleOttimismo/raw/main/Cover6.jpg,-15,"Abbiamo attualmente 19512 pazienti RICOVERATI IN REPARTO, pari al 31% dei posti letto disponibili (fonte: AGENAS). Negli ultimi 7 giorni la variazione media del numero di pazienti ricoverati è stata pari a -115 pazienti al giorno (era -148 nei sette giorni precedenti). La variazione percentuale complessiva sul totale dei pazienti ricoverati in questi sette giorni è stata -4%",5,,,,,,
TI,https://github.com/Paulsword/PilloleOttimismo/raw/main/Cover5.jpg,0,"Oggi in TERAPIA INTENSIVA saldo di 0 pazienti (146 ingressi e 146 uscite). La variazione del totale degli INGRESSI in TI negli ultimi sette giorni, rispetto ai sette giorni precedenti, è stata del +5.5% (ieri era +6.3%, il giorno prima +6.4%).
I pazienti in TI sono complessivamente 2143, pari al 24% dei posti letto attualmente disponibili. Negli ultimi sette giorni la variazione percentuale complessiva è stata -3.2%",6,,,,,,
Decessi,https://github.com/Paulsword/PilloleOttimismo/raw/main/Cover7.jpg,422,"In media abbiamo avuto in Italia 380 DECESSI al giorno negli ultimi sette giorni, e 417 nei sette giorni precedenti. La variazione dei decessi in questi ultimi sette giorni, rispetto ai sette precedenti, è stata pari a -9% (ieri era -7.7%, il giorno prima -9.8%, prima ancora -12.6%, -13.3%, -10%, -8.7%).",7,,,,,,
Vaccini,https://github.com/Paulsword/PilloleOttimismo/raw/main/Cover8.jpg,2687609,"Ad oggi in Italia abbiamo eseguito 2687609 dosi di vaccino. 1478483 persone, pari al 2.45% della popolazione, hanno ricevuto la prima dose, e 1209126 persone, pari al 2% della popolazione, hanno ricevuto anche la seconda dose.",8,,,,,,
