Title,Image,Subtitle,Trend,Color,,,,,,
Aggiornamento,https://github.com/Paulsword/PilloleOttimismo/raw/main/Cover0.jpg,13 settembre 2021,,1,,,,,,
Incidenza,https://github.com/Paulsword/PilloleOttimismo/raw/main/Cover1.jpg,58.1,"L'INCIDENZA su base nazionale è al momento pari a 58.1 nuovi positivi ogni 100.000 abitanti in 7 giorni (ieri era 59). Le Regioni con i valori più elevati sono Sicilia, con 122.4 casi, Bolzano (95.2), Calabria (90.1), e Veneto (78.1). L'incidenza più bassa è in Valle d'Aosta, con 16.1 casi.",2,,,,,,
Variazione,https://github.com/Paulsword/PilloleOttimismo/raw/main/Cover2.jpg,-14.6%,"La VARIAZIONE PERCENTUALE dei nuovi casi negli ultimi sette giorni, rispetto ai sette precedenti, è stata pari a -14.6% (ieri era -15.1%, il giorno prima -14.9%, prima ancora -14%, -13.6%, -11.7%, -12.5%). I valori più elevati tra le Regioni si riscontrano in Bolzano (+11.4% negli ultimi sette giorni rispetto ai sette precedenti), Trento (+9.3%), Abruzzo (+3.2%), Piemonte (-4.3%), Friuli VG (-4.5%), Lombardia (-4.8%), Campania (-5.2%), Calabria (-7.6%), Valle d'Aosta (-9.1%).",3,,,,,,
Nuovi casi,https://github.com/Paulsword/PilloleOttimismo/raw/main/Cover3.jpg,2800,"Sono 2800 i nuovi positivi registrati oggi, su 120045 tamponi (2.3%) e 27498 persone testate (10.18%).
Negli ultimi sette giorni abbiamo avuto in media 4918 nuovi positivi al giorno, ossia -838 casi al giorno rispetto ai sette giorni precedenti (ieri era -886).",4,,,,,,
Ricoveri,https://github.com/Paulsword/PilloleOttimismo/raw/main/Cover6.jpg,+87,"Abbiamo attualmente 4200 pazienti RICOVERATI IN REPARTO, pari al 7.3% dei posti letto disponibili (fonte: AGENAS). Negli ultimi 7 giorni la variazione media del numero di pazienti ricoverati è stata pari a -15 pazienti al giorno (era +5 nei sette giorni precedenti). La variazione percentuale complessiva sul totale dei pazienti ricoverati in questi sette giorni è stata -2.4%",5,,,,,,
TI,https://github.com/Paulsword/PilloleOttimismo/raw/main/Cover5.jpg,+4,"Oggi in TERAPIA INTENSIVA saldo di +4 pazienti (35 ingressi e 31 uscite). La variazione del totale degli INGRESSI in TI negli ultimi sette giorni, rispetto ai sette giorni precedenti, è stata del -12.6% (ieri era -18.4%, il giorno prima -19.9%).
I pazienti in TI sono complessivamente 563, pari al 6.2% dei posti letto attualmente disponibili. Negli ultimi sette giorni la variazione percentuale complessiva è stata -1.2%",6,,,,,,
Decessi,https://github.com/Paulsword/PilloleOttimismo/raw/main/Cover7.jpg,36,"In media abbiamo registrato in Italia 55 DECESSI al giorno negli ultimi sette giorni, e 60 nei sette giorni precedenti. La variazione dei decessi in questi ultimi sette giorni, rispetto ai sette precedenti, è stata pari a -7.8% (ieri era -4.3%, il giorno prima +2.2%, prima ancora +2.5%, +4.8%, +10.9%, +13.9%). Si ricordi tuttavia che molti decessi registrati risalgono alle settimane o ai mesi precedenti.",7,,,,,,
Vaccini,https://github.com/Paulsword/PilloleOttimismo/raw/main/Cover8.jpg,126 164,"Il 12/9/2021 sono state 126 164 le somministrazioni di vaccino. Ad oggi in Italia abbiamo eseguito 81 097 687 dosi. Il 73.97% della popolazione ha ricevuto almeno una dose, e il 67.61% della popolazione ha ricevuto vaccinazione completa.",8,,,,,,
