Title,Image,Subtitle,Trend,Color,,,,,,
Aggiornamento,https://github.com/Paulsword/PilloleOttimismo/raw/main/Cover0.jpg,23 ottobre 2021,,1,,,,,,
Incidenza,https://github.com/Paulsword/PilloleOttimismo/raw/main/Cover1.jpg,37.1,"L'INCIDENZA su base nazionale è al momento pari a 37.1 nuovi positivi ogni 100.000 abitanti in 7 giorni (ieri era 35.6). Le Regioni con i valori più elevati sono Bolzano, con 81.5 casi, Friuli VG (58), Veneto (50.3), e Umbria (49.1). L'incidenza più bassa è in Sardegna, con 8.3 casi.",2,,,,,,
Variazione,https://github.com/Paulsword/PilloleOttimismo/raw/main/Cover2.jpg,+26.3%,"La VARIAZIONE PERCENTUALE dei nuovi casi negli ultimi sette giorni, rispetto ai sette precedenti, è stata pari a +26.3% (ieri era +22.6%, il giorno prima +14%, prima ancora +5.9%, -1.9%, -2.8%, -3.8%). I valori più elevati tra le Regioni si riscontrano in Umbria (+177.8% negli ultimi sette giorni rispetto ai sette precedenti), Abruzzo (+73%), Molise (+72%), Lazio (+47.3%), Puglia (+43.4%), Marche (+43.3%), Bolzano (+35.1%), Friuli VG (+34.7%), Trento (+31.4%).",3,,,,,,
Nuovi casi,https://github.com/Paulsword/PilloleOttimismo/raw/main/Cover3.jpg,3908,"Sono 3908 i nuovi positivi registrati oggi, su 491574 tamponi (0.8%) e 63682 persone testate (6.14%).
Negli ultimi sette giorni abbiamo avuto in media 3143 nuovi positivi al giorno, ossia +654 casi al giorno rispetto ai sette giorni precedenti (ieri era +554).",4,,,,,,
Ricoveri,https://github.com/Paulsword/PilloleOttimismo/raw/main/Cover6.jpg,+12,"Abbiamo attualmente 2455 pazienti RICOVERATI IN REPARTO, pari al 4.3% dei posti letto disponibili (fonte: AGENAS). Negli ultimi 7 giorni la variazione media del numero di pazienti ricoverati è stata pari a +12 pazienti al giorno (era -46 nei sette giorni precedenti). La variazione percentuale complessiva sul totale dei pazienti ricoverati in questi sette giorni è stata +3.5%",5,,,,,,
TI,https://github.com/Paulsword/PilloleOttimismo/raw/main/Cover5.jpg,-5,"Oggi in TERAPIA INTENSIVA saldo di -5 pazienti (20 ingressi e 25 uscite). La variazione del totale degli INGRESSI in TI negli ultimi sette giorni, rispetto ai sette giorni precedenti, è stata del +25.6% (ieri era +15.5%, il giorno prima +16.7%).
I pazienti in TI sono complessivamente 338, pari al 3.7% dei posti letto attualmente disponibili. Negli ultimi sette giorni la variazione percentuale complessiva è stata -4%",6,,,,,,
Decessi,https://github.com/Paulsword/PilloleOttimismo/raw/main/Cover7.jpg,39,"In media abbiamo registrato in Italia 41 DECESSI al giorno negli ultimi sette giorni, e 35 nei sette giorni precedenti. La variazione dei decessi in questi ultimi sette giorni, rispetto ai sette precedenti, è stata pari a +17.3% (ieri era -5.5%, il giorno prima 0%, prima ancora +1.1%, +1.9%, -6.4%, -11.1%). Si ricordi tuttavia che molti decessi registrati risalgono alle settimane o ai mesi precedenti.",7,,,,,,
Vaccini,https://github.com/Paulsword/PilloleOttimismo/raw/main/Cover8.jpg,98 648,"Il 22/10/2021 sono state 98 648 le somministrazioni di vaccino. Ad oggi in Italia abbiamo eseguito 88 627 273 dosi. Il 78.38% della popolazione ha ricevuto almeno una dose, e il 74.79% della popolazione ha ricevuto vaccinazione completa. 987284 persone hanno ricevuto una dose aggiuntiva (1.67% della popolazione).",8,,,,,,
