Title,Image,Subtitle,Trend,Color,,,,,,
Aggiornamento,https://github.com/Paulsword/PilloleOttimismo/raw/main/Cover0.jpg,20 agosto 2021,,1,,,,,,
Incidenza,https://github.com/Paulsword/PilloleOttimismo/raw/main/Cover1.jpg,73.2,"L'INCIDENZA su base nazionale è al momento pari a 73.2 nuovi positivi ogni 100.000 abitanti in 7 giorni (ieri era 73.5). Le Regioni con i valori più elevati sono Sicilia, con 164.2 casi, Sardegna (156.5), Toscana (124), e Emilia Romagna (87.3). L'incidenza più bassa è in Molise, con 28.3 casi.",2,,,,,,
Variazione,https://github.com/Paulsword/PilloleOttimismo/raw/main/Cover2.jpg,-1.4%,"La VARIAZIONE PERCENTUALE dei nuovi casi negli ultimi sette giorni, rispetto ai sette precedenti, è stata pari a -1.4% (ieri era +0.8%, il giorno prima +0.9%, prima ancora +1.4%, +3.9%, +7.7%, +9%). I valori più elevati tra le Regioni si riscontrano in Valle d'Aosta (+48.2% negli ultimi sette giorni rispetto ai sette precedenti), Molise (+33.3%), Sicilia (+22.9%), Liguria (+17.8%), Calabria (+12.6%), Basilicata (+10.4%), Trento (+8.4%), Sardegna (+6.2%), Piemonte (+5.8%).",3,,,,,,
Nuovi casi,https://github.com/Paulsword/PilloleOttimismo/raw/main/Cover3.jpg,7224,"Sono 7224 i nuovi positivi registrati oggi, su 220656 tamponi (3.3%) e 50471 persone testate (14.31%).
Negli ultimi sette giorni abbiamo avuto in media 6201 nuovi positivi al giorno, ossia -90 casi al giorno rispetto ai sette giorni precedenti (ieri era +50).",4,,,,,,
Ricoveri,https://github.com/Paulsword/PilloleOttimismo/raw/main/Cover6.jpg,+65,"Abbiamo attualmente 3692 pazienti RICOVERATI IN REPARTO, pari al 6.5% dei posti letto disponibili (fonte: AGENAS). Negli ultimi 7 giorni la variazione media del numero di pazienti ricoverati è stata pari a +94 pazienti al giorno (era +83 nei sette giorni precedenti). La variazione percentuale complessiva sul totale dei pazienti ricoverati in questi sette giorni è stata +21.7%",5,,,,,,
TI,https://github.com/Paulsword/PilloleOttimismo/raw/main/Cover5.jpg,-5,"Oggi in TERAPIA INTENSIVA saldo di -5 pazienti (26 ingressi e 31 uscite). La variazione del totale degli INGRESSI in TI negli ultimi sette giorni, rispetto ai sette giorni precedenti, è stata del +14.3% (ieri era +19.8%, il giorno prima +25.1%).
I pazienti in TI sono complessivamente 455, pari al 5.1% dei posti letto attualmente disponibili. Negli ultimi sette giorni la variazione percentuale complessiva è stata +23.3%",6,,,,,,
Decessi,https://github.com/Paulsword/PilloleOttimismo/raw/main/Cover7.jpg,49,"In media abbiamo registrato in Italia 43 DECESSI al giorno negli ultimi sette giorni, e 27 nei sette giorni precedenti. La variazione dei decessi in questi ultimi sette giorni, rispetto ai sette precedenti, è stata pari a +58.3% (ieri era +75.4%, il giorno prima +63.7%, prima ancora +50%, +39%, +36.8%, +39.7%). Si ricordi tuttavia che molti decessi registrati risalgono alle settimane o ai mesi precedenti.",7,,,,,,
Vaccini,https://github.com/Paulsword/PilloleOttimismo/raw/main/Cover8.jpg,230 717,"Il 19/8/2021 sono state 230 717 le somministrazioni di vaccino. Ad oggi in Italia abbiamo eseguito 75 040 135 dosi. Il 69.78% della popolazione ha ricevuto almeno una dose, e il 61.1% della popolazione ha ricevuto vaccinazione completa.",8,,,,,,
