Title,Image,Subtitle,Trend,Color,,,,,,
Aggiornamento,https://github.com/Paulsword/PilloleOttimismo/raw/main/Cover0.jpg,24 febbraio 2022,,1,,,,,,
Incidenza,https://github.com/Paulsword/PilloleOttimismo/raw/main/Cover1.jpg,553,"L'INCIDENZA su base nazionale è al momento pari a 553 nuovi positivi ogni 100.000 abitanti in 7 giorni (ieri era 573). Le Regioni con i valori più elevati sono Bolzano, con 820 casi, Abruzzo (773), Marche (740), e Sicilia (733). L'incidenza più bassa è in Valle d'Aosta, con 262 casi.",2,,,,,,
Variazione,https://github.com/Paulsword/PilloleOttimismo/raw/main/Cover2.jpg,-18%,"La VARIAZIONE PERCENTUALE dei nuovi casi negli ultimi sette giorni, rispetto ai sette precedenti, è stata pari a -18% (ieri era -18.8%, il giorno prima -20.6%, prima ancora -23.5%, -24.7%, -26.4%, -28.4%). I valori più elevati tra le Regioni si riscontrano in Sicilia (-7.9% negli ultimi sette giorni rispetto ai sette precedenti), Abruzzo (-9.4%), Calabria (-9.8%), Umbria (-11.6%), Basilicata (-12.7%), Liguria (-12.9%), Puglia (-13.3%), Lazio (-14.6%), Lombardia (-14.8%).",3,,,,,,
Nuovi casi,https://github.com/Paulsword/PilloleOttimismo/raw/main/Cover3.jpg,46169,"Sono 46169 i nuovi positivi registrati oggi, su 484530 tamponi (9.5%).
Negli ultimi sette giorni abbiamo avuto in media 46777 nuovi positivi al giorno, ossia -10287 casi al giorno rispetto ai sette giorni precedenti (ieri era -11191).",4,,,,,,
Ricoveri,https://github.com/Paulsword/PilloleOttimismo/raw/main/Cover6.jpg,-402,"Abbiamo attualmente 12125 pazienti RICOVERATI IN REPARTO, pari al 18.5% dei posti letto disponibili (fonte: AGENAS). Negli ultimi 7 giorni la variazione media del numero di pazienti ricoverati è stata pari a -348 pazienti al giorno (era -399 nei sette giorni precedenti). La variazione percentuale complessiva sul totale dei pazienti ricoverati in questi sette giorni è stata -16.7%",5,,,,,,
TI,https://github.com/Paulsword/PilloleOttimismo/raw/main/Cover5.jpg,-47,"Oggi in TERAPIA INTENSIVA saldo di -47 pazienti (56 ingressi e 103 uscite). La variazione del totale degli INGRESSI in TI negli ultimi sette giorni, rispetto ai sette giorni precedenti, è stata del -14.3% (ieri era -13.5%, il giorno prima -16.9%).
I pazienti in TI sono complessivamente 839, pari al 8.7% dei posti letto attualmente disponibili. Negli ultimi sette giorni la variazione percentuale complessiva è stata -19.1%",6,,,,,,
Decessi,https://github.com/Paulsword/PilloleOttimismo/raw/main/Cover7.jpg,249,"In media abbiamo registrato in Italia 247 DECESSI al giorno negli ultimi sette giorni, e 294 nei sette giorni precedenti. La variazione dei decessi in questi ultimi sette giorni, rispetto ai sette precedenti, è stata pari a -16% (ieri era -12.8%, il giorno prima -15.8%, prima ancora -13.9%, -12%, -11.3%, -14.5%). Si ricordi tuttavia che molti decessi registrati risalgono alle settimane o ai mesi precedenti.",7,,,,,,
Vaccini,https://github.com/Paulsword/PilloleOttimismo/raw/main/Cover8.jpg,110 928,"Il 23/2/2022 sono state 110 928 le somministrazioni di vaccino. Ad oggi in Italia abbiamo eseguito 133 358 450 dosi. Il 85.4% della popolazione ha ricevuto almeno una dose, e il 83.03% della popolazione ha ricevuto vaccinazione completa. 37154220 persone hanno ricevuto una dose aggiuntiva (62.7% della popolazione).
NB: queste percentuali variano, come vedrete nelle slide, se per valutare la copertura immunitaria efficace si considerano anche i 14 giorni necessari per lo sviluppo anticorpale dopo la somministrazione.",8,,,,,,
