Title,Image,Subtitle,Trend,Color,,,,,,
Aggiornamento,https://github.com/Paulsword/PilloleOttimismo/raw/main/Cover0.jpg,16 agosto 2021,,1,,,,,,
Incidenza,https://github.com/Paulsword/PilloleOttimismo/raw/main/Cover1.jpg,73.8,"L'INCIDENZA su base nazionale è al momento pari a 73.8 nuovi positivi ogni 100.000 abitanti in 7 giorni (ieri era 74.7). Le Regioni con i valori più elevati sono Sardegna, con 155 casi, Sicilia (140.3), Toscana (134), e Umbria (96.9). L'incidenza più bassa è in Molise, con 23.6 casi.",2,,,,,,
Variazione,https://github.com/Paulsword/PilloleOttimismo/raw/main/Cover2.jpg,+3.9%,"La VARIAZIONE PERCENTUALE dei nuovi casi negli ultimi sette giorni, rispetto ai sette precedenti, è stata pari a +3.9% (ieri era +7.7%, il giorno prima +9%, prima ancora +9.4%, +7.3%, +10.1%, +11.7%). I valori più elevati tra le Regioni si riscontrano in Bolzano (+78.1% negli ultimi sette giorni rispetto ai sette precedenti), Trento (+40.1%), Calabria (+39.5%), Piemonte (+23.4%), Sicilia (+17.9%), Puglia (+14.6%), Liguria (+14.2%), Molise (+12.9%), Toscana (+10.2%).",3,,,,,,
Nuovi casi,https://github.com/Paulsword/PilloleOttimismo/raw/main/Cover3.jpg,3674,"Sono 3674 i nuovi positivi registrati oggi, su 74021 tamponi (5%) e 21059 persone testate (17.45%).
Negli ultimi sette giorni abbiamo avuto in media 6248 nuovi positivi al giorno, ossia +237 casi al giorno rispetto ai sette giorni precedenti (ieri era +453).",4,,,,,,
Ricoveri,https://github.com/Paulsword/PilloleOttimismo/raw/main/Cover6.jpg,+172,"Abbiamo attualmente 3334 pazienti RICOVERATI IN REPARTO, pari al 5.9% dei posti letto disponibili (fonte: AGENAS). Negli ultimi 7 giorni la variazione media del numero di pazienti ricoverati è stata pari a +78 pazienti al giorno (era +102 nei sette giorni precedenti). La variazione percentuale complessiva sul totale dei pazienti ricoverati in questi sette giorni è stata +19.7%",5,,,,,,
TI,https://github.com/Paulsword/PilloleOttimismo/raw/main/Cover5.jpg,+20,"Oggi in TERAPIA INTENSIVA saldo di +20 pazienti (32 ingressi e 12 uscite). La variazione del totale degli INGRESSI in TI negli ultimi sette giorni, rispetto ai sette giorni precedenti, è stata del +24.9% (ieri era +38.9%, il giorno prima +37.6%).
I pazienti in TI sono complessivamente 404, pari al 4.6% dei posti letto attualmente disponibili. Negli ultimi sette giorni la variazione percentuale complessiva è stata +25.1%",6,,,,,,
Decessi,https://github.com/Paulsword/PilloleOttimismo/raw/main/Cover7.jpg,24,"In media abbiamo registrato in Italia 31 DECESSI al giorno negli ultimi sette giorni, e 22 nei sette giorni precedenti. La variazione dei decessi in questi ultimi sette giorni, rispetto ai sette precedenti, è stata pari a +39% (ieri era +36.8%, il giorno prima +39.7%, prima ancora +37.1%, +27.6%, +33.3%, +31.7%). Si ricordi tuttavia che molti decessi registrati risalgono alle settimane o ai mesi precedenti.",7,,,,,,
Vaccini,https://github.com/Paulsword/PilloleOttimismo/raw/main/Cover8.jpg,504 63,"Il 15/8/2021 sono state 504 63 le somministrazioni di vaccino. Ad oggi in Italia abbiamo eseguito 73 882 096 dosi. Il 68.73% della popolazione ha ricevuto almeno una dose, e il 60.11% della popolazione ha ricevuto vaccinazione completa.",8,,,,,,
