Title,Image,Subtitle,Trend,Color,,,,,,
Aggiornamento,https://github.com/Paulsword/PilloleOttimismo/raw/main/Cover0.jpg,22 aprile 2021,,1,,,,,,
Incidenza,https://github.com/Paulsword/PilloleOttimismo/raw/main/Cover1.jpg,159,"L'INCIDENZA su base nazionale è al momento pari a 159 nuovi positivi ogni 100.000 abitanti in 7 giorni. Le Regioni con i valori più elevati sono Puglia, con 231 casi, seguono Valle d'Aosta (227), Campania (224), e Basilicata (201). L'incidenza più bassa è in Umbria, con 83 casi.
Nei grafici trovate i valori di incidenza dei Paesi d'Europa, calcolati su 14 giorni.",2,,,,,,
Variazione,https://github.com/Paulsword/PilloleOttimismo/raw/main/Cover2.jpg,-12.7%,"La VARIAZIONE PERCENTUALE dei nuovi casi negli ultimi sette giorni, rispetto ai sette precedenti, è stata pari a -12.7% (ieri era -12%, il giorno prima -7.8%, prima ancora -1.2%, -1.2%, -0.4%, -1.8%). I valori più elevati tra le Regioni si riscontrano in Bolzano (+1.5% negli ultimi sette giorni rispetto ai sette precedenti), Molise (-1.9%), Veneto (-5.5%), Campania (-5.8%), Sicilia (-8.8%), Lazio (-10.3%), Puglia (-11.4%), Toscana (-12.8%), Lombardia (-14.3%).",3,,,,,,
Nuovi casi,https://github.com/Paulsword/PilloleOttimismo/raw/main/Cover3.jpg,16050,"Sono 16050 i nuovi positivi registrati oggi, su 364804 tamponi (4.4%) e 111105 persone testate (14.45%).
Negli ultimi sette giorni abbiamo avuto in media 13544 nuovi positivi al giorno, ossia -1963 casi al giorno rispetto ai sette giorni precedenti (ieri era -1870).",4,,,,,,
Ricoveri,https://github.com/Paulsword/PilloleOttimismo/raw/main/Cover6.jpg,-690,"Abbiamo attualmente 22094 pazienti RICOVERATI IN REPARTO, pari al 34% dei posti letto disponibili (fonte: AGENAS). Negli ultimi 7 giorni la variazione media del numero di pazienti ricoverati è stata pari a -499 pazienti al giorno (era -466 nei sette giorni precedenti). La variazione percentuale complessiva sul totale dei pazienti ricoverati in questi sette giorni è stata -13.7%",5,,,,,,
TI,https://github.com/Paulsword/PilloleOttimismo/raw/main/Cover5.jpg,-55,"Oggi in TERAPIA INTENSIVA saldo di -55 pazienti (174 ingressi e 229 uscite). La variazione del totale degli INGRESSI in TI negli ultimi sette giorni, rispetto ai sette giorni precedenti, è stata del -15.3% (ieri era -15.5%, il giorno prima -14.8%).
I pazienti in TI sono complessivamente 3021, pari al 33% dei posti letto attualmente disponibili. Negli ultimi sette giorni la variazione percentuale complessiva è stata -11.6%",6,,,,,,
Decessi,https://github.com/Paulsword/PilloleOttimismo/raw/main/Cover7.jpg,360,"In media abbiamo avuto in Italia 346 DECESSI al giorno negli ultimi sette giorni, e 403 nei sette giorni precedenti. La variazione dei decessi in questi ultimi sette giorni, rispetto ai sette precedenti, è stata pari a -14.2% (ieri era -16.8%, il giorno prima -17.7%, prima ancora -13.5%, -10.3%, -7.6%, -7.5%).",7,,,,,,
Vaccini,https://github.com/Paulsword/PilloleOttimismo/raw/main/Cover8.jpg,16 414 981,"Ad oggi in Italia abbiamo eseguito 16414981 dosi di vaccino. 11585761 persone, pari al 19.43% della popolazione, hanno ricevuto la prima dose, e 4829220 persone, pari al 8.1% della popolazione, hanno ricevuto anche la seconda dose.",8,,,,,,
Zone rosse,https://github.com/Paulsword/PilloleOttimismo/raw/main/Cover9.jpg,13,"Delle attuali 13 Province in fascia rossa, 10 (pari a 4733947 persone) hanno un'incidenza al di sotto dei 250 casi settimanali ogni 100.000 abitanti. Qui proponiamo un modello su base provinciale e con soglia di incidenza rigorosamente correlata alla ricettività ospedaliera. Al momento, 75 Province al di sotto di quella soglia sono in regime di restrizione, e 6 di queste sono in fascia rossa.  Viceversa, 25 Province che secondo il nostro modello sono sopra-soglia, si trovano invece in arancione.",9,,,,,,
