Title,Image,Subtitle,Trend,Color,,,,,,
Aggiornamento,https://github.com/Paulsword/PilloleOttimismo/raw/main/Cover0.jpg,29 marzo 2021,,1,,,,,,
Incidenza,https://github.com/Paulsword/PilloleOttimismo/raw/main/Cover1.jpg,242,"L'INCIDENZA su base nazionale è al momento pari a 242 nuovi positivi ogni 100.000 abitanti in 7 giorni. Le Regioni con i valori più elevati sono Friuli VG, con 360 casi, seguono Valle d'Aosta (358), Piemonte (341), e Emilia Romagna (316). L'incidenza più bassa è in Molise, con 84 casi.
Nei grafici trovate i valori di incidenza dei Paesi d'Europa, calcolati su 14 giorni.",2,,,,,,
Variazione,https://github.com/Paulsword/PilloleOttimismo/raw/main/Cover2.jpg,-5.1%,"La VARIAZIONE PERCENTUALE dei nuovi casi negli ultimi sette giorni, rispetto ai sette precedenti, è stata pari a -5.1% (ieri era -5.4%, il giorno prima -5.7%, prima ancora -7.2%, -6.6%, -6.3%, -4.8%). I valori più elevati tra le Regioni si riscontrano in Sardegna (+66% negli ultimi sette giorni rispetto ai sette precedenti), Valle d'Aosta (+42.4%), Liguria (+18.5%), Calabria (+16.5%), Sicilia (+14.9%), Puglia (+9.5%), Umbria (+1%), Lazio (-0.6%), Toscana (-2.6%).",3,,,,,,
Nuovi casi,https://github.com/Paulsword/PilloleOttimismo/raw/main/Cover3.jpg,12916,"Sono 12916 i nuovi positivi registrati oggi, su 156692 tamponi (8.2%) e 54751 persone testate (23.59%).
Negli ultimi sette giorni abbiamo avuto in media 20587 nuovi positivi al giorno, ossia -1100 casi al giorno rispetto ai sette giorni precedenti (ieri era -1177).",4,,,,,,
Ricoveri,https://github.com/Paulsword/PilloleOttimismo/raw/main/Cover6.jpg,+462,"Abbiamo attualmente 29163 pazienti RICOVERATI IN REPARTO, pari al 44% dei posti letto disponibili (fonte: AGENAS). Negli ultimi 7 giorni la variazione media del numero di pazienti ricoverati è stata pari a +159 pazienti al giorno (era +387 nei sette giorni precedenti). La variazione percentuale complessiva sul totale dei pazienti ricoverati in questi sette giorni è stata +4%",5,,,,,,
TI,https://github.com/Paulsword/PilloleOttimismo/raw/main/Cover5.jpg,+42,"Oggi in TERAPIA INTENSIVA saldo di +42 pazienti (192 ingressi e 150 uscite). La variazione del totale degli INGRESSI in TI negli ultimi sette giorni, rispetto ai sette giorni precedenti, è stata del 0% (ieri era +1%, il giorno prima +1.2%).
I pazienti in TI sono complessivamente 3721, pari al 41% dei posti letto attualmente disponibili. Negli ultimi sette giorni la variazione percentuale complessiva è stata +6%",6,,,,,,
Decessi,https://github.com/Paulsword/PilloleOttimismo/raw/main/Cover7.jpg,417,"In media abbiamo avuto in Italia 432 DECESSI al giorno negli ultimi sette giorni, e 404 nei sette giorni precedenti. La variazione dei decessi in questi ultimi sette giorni, rispetto ai sette precedenti, è stata pari a +6.8% (ieri era +6.9%, il giorno prima +8.4%, prima ancora +12.6%, +10.2%, +10.9%, +14.1%).",7,,,,,,
Vaccini,https://github.com/Paulsword/PilloleOttimismo/raw/main/Cover8.jpg,9499293,"Ad oggi in Italia abbiamo eseguito 9499293 dosi di vaccino. 6502360 persone, pari al 10.9% della popolazione, hanno ricevuto la prima dose, e 2996933 persone, pari al 5.02% della popolazione, hanno ricevuto anche la seconda dose.",8,,,,,,
Zone rosse,https://github.com/Paulsword/PilloleOttimismo/raw/main/Cover9.jpg,73,"Delle attuali 73 Province in fascia rossa, 31 (pari a 16089485 persone) hanno un'incidenza al di sotto dei 250 casi settimanali ogni 100.000 abitanti. Qui proponiamo un modello su base provinciale e con soglia di incidenza rigorosamente correlata alla ricettività ospedaliera. Al momento, 33 Province al di sotto di quella soglia sono in regime di restrizione, e 8 di queste sono in fascia rossa. Viceversa, 9 Province che secondo il nostro modello sono sopra-soglia, si trovano invece in arancione.",9,,,,,,
