Title,Image,Subtitle,Trend,Color,,,,,,
Aggiornamento,https://github.com/Paulsword/PilloleOttimismo/raw/main/Cover0.jpg,8 febbraio 2022,,1,,,,,,
Incidenza,https://github.com/Paulsword/PilloleOttimismo/raw/main/Cover1.jpg,1092,"L'INCIDENZA su base nazionale è al momento pari a 1092 nuovi positivi ogni 100.000 abitanti in 7 giorni (ieri era 1145). Le Regioni con i valori più elevati sono Bolzano, con 1718 casi, Marche (1514), Friuli VG (1406), e Veneto (1404). L'incidenza più bassa è in Calabria, con 655 casi.",2,,,,,,
Variazione,https://github.com/Paulsword/PilloleOttimismo/raw/main/Cover2.jpg,-28.2%,"La VARIAZIONE PERCENTUALE dei nuovi casi negli ultimi sette giorni, rispetto ai sette precedenti, è stata pari a -28.2% (ieri era -31%, il giorno prima -30.5%, prima ancora -30.3%, -28.3%, -26.7%, -25.1%). I valori più elevati tra le Regioni si riscontrano in Sardegna (+104.4% negli ultimi sette giorni rispetto ai sette precedenti), Calabria (+19.9%), Sicilia (+2.4%), Molise (-2.5%), Basilicata (-9.4%), Puglia (-10.9%), Campania (-19.9%), Umbria (-20.1%), Lazio (-22.1%).",3,,,,,,
Nuovi casi,https://github.com/Paulsword/PilloleOttimismo/raw/main/Cover3.jpg,101864,"Sono 101864 i nuovi positivi registrati oggi, su 999095 tamponi (10.2%).
Negli ultimi sette giorni abbiamo avuto in media 92467 nuovi positivi al giorno, ossia -36235 casi al giorno rispetto ai sette giorni precedenti (ieri era -43505).",4,,,,,,
Ricoveri,https://github.com/Paulsword/PilloleOttimismo/raw/main/Cover6.jpg,-338,"Abbiamo attualmente 18337 pazienti RICOVERATI IN REPARTO, pari al 28% dei posti letto disponibili (fonte: AGENAS). Negli ultimi 7 giorni la variazione media del numero di pazienti ricoverati è stata pari a -219 pazienti al giorno (era -23 nei sette giorni precedenti). La variazione percentuale complessiva sul totale dei pazienti ricoverati in questi sette giorni è stata -7.7%",5,,,,,,
TI,https://github.com/Paulsword/PilloleOttimismo/raw/main/Cover5.jpg,-47,"Oggi in TERAPIA INTENSIVA saldo di -47 pazienti (99 ingressi e 146 uscite). La variazione del totale degli INGRESSI in TI negli ultimi sette giorni, rispetto ai sette giorni precedenti, è stata del -14.3% (ieri era -15.8%, il giorno prima -9.5%).
I pazienti in TI sono complessivamente 1376, pari al 14.2% dei posti letto attualmente disponibili. Negli ultimi sette giorni la variazione percentuale complessiva è stata -11.2%",6,,,,,,
Decessi,https://github.com/Paulsword/PilloleOttimismo/raw/main/Cover7.jpg,415,"In media abbiamo registrato in Italia 370 DECESSI al giorno negli ultimi sette giorni, e 369 nei sette giorni precedenti. La variazione dei decessi in questi ultimi sette giorni, rispetto ai sette precedenti, è stata pari a +0.2% (ieri era -0.9%, il giorno prima -0.2%, prima ancora +0.4%, +2.2%, +0.2%, -0.6%). Si ricordi tuttavia che molti decessi registrati risalgono alle settimane o ai mesi precedenti.",7,,,,,,
Vaccini,https://github.com/Paulsword/PilloleOttimismo/raw/main/Cover8.jpg,270 617,"Il 7/2/2022 sono state 270 617 le somministrazioni di vaccino. Ad oggi in Italia abbiamo eseguito 131 102 095 dosi. Il 85.32% della popolazione ha ricevuto almeno una dose, e il 81.86% della popolazione ha ricevuto vaccinazione completa. 35291972 persone hanno ricevuto una dose aggiuntiva (59.56% della popolazione).
NB: queste percentuali variano, come vedrete nelle slide, se per valutare la copertura immunitaria efficace si considerano anche i 14 giorni necessari per lo sviluppo anticorpale dopo la somministrazione.",8,,,,,,
