Title,Image,Subtitle,Trend,Color,,,,,,
Aggiornamento,https://github.com/Paulsword/PilloleOttimismo/raw/main/Cover0.jpg,21 agosto 2021,,1,,,,,,
Incidenza,https://github.com/Paulsword/PilloleOttimismo/raw/main/Cover1.jpg,73.7,"L'INCIDENZA su base nazionale è al momento pari a 73.7 nuovi positivi ogni 100.000 abitanti in 7 giorni (ieri era 73.2). Le Regioni con i valori più elevati sono Sicilia, con 179.2 casi, Sardegna (146.7), Toscana (122.8), e Umbria (87.6). L'incidenza più bassa è in Molise, con 27 casi.",2,,,,,,
Variazione,https://github.com/Paulsword/PilloleOttimismo/raw/main/Cover2.jpg,-1.4%,"La VARIAZIONE PERCENTUALE dei nuovi casi negli ultimi sette giorni, rispetto ai sette precedenti, è stata pari a -1.4% (ieri era -1.4%, il giorno prima +0.8%, prima ancora +0.9%, +1.4%, +3.9%, +7.7%). I valori più elevati tra le Regioni si riscontrano in Valle d'Aosta (+54.7% negli ultimi sette giorni rispetto ai sette precedenti), Molise (+33.3%), Sicilia (+29.3%), Calabria (+16.5%), Liguria (+9.3%), Bolzano (+8.6%), Trento (+6.6%), Basilicata (+5.5%), Abruzzo (+5.4%).",3,,,,,,
Nuovi casi,https://github.com/Paulsword/PilloleOttimismo/raw/main/Cover3.jpg,7470,"Sono 7470 i nuovi positivi registrati oggi, su 255218 tamponi (2.9%) e 59645 persone testate (12.52%).
Negli ultimi sette giorni abbiamo avuto in media 6241 nuovi positivi al giorno, ossia -91 casi al giorno rispetto ai sette giorni precedenti (ieri era -91).",4,,,,,,
Ricoveri,https://github.com/Paulsword/PilloleOttimismo/raw/main/Cover6.jpg,+41,"Abbiamo attualmente 3733 pazienti RICOVERATI IN REPARTO, pari al 6.6% dei posti letto disponibili (fonte: AGENAS). Negli ultimi 7 giorni la variazione media del numero di pazienti ricoverati è stata pari a +90 pazienti al giorno (era +81 nei sette giorni precedenti). La variazione percentuale complessiva sul totale dei pazienti ricoverati in questi sette giorni è stata +20.4%",5,,,,,,
TI,https://github.com/Paulsword/PilloleOttimismo/raw/main/Cover5.jpg,+11,"Oggi in TERAPIA INTENSIVA saldo di +11 pazienti (40 ingressi e 29 uscite). La variazione del totale degli INGRESSI in TI negli ultimi sette giorni, rispetto ai sette giorni precedenti, è stata del +11.8% (ieri era +14.3%, il giorno prima +19.8%).
I pazienti in TI sono complessivamente 466, pari al 5.3% dei posti letto attualmente disponibili. Negli ultimi sette giorni la variazione percentuale complessiva è stata +25.3%",6,,,,,,
Decessi,https://github.com/Paulsword/PilloleOttimismo/raw/main/Cover7.jpg,45,"In media abbiamo registrato in Italia 45 DECESSI al giorno negli ultimi sette giorni, e 29 nei sette giorni precedenti. La variazione dei decessi in questi ultimi sette giorni, rispetto ai sette precedenti, è stata pari a +54.4% (ieri era +58.3%, il giorno prima +75.4%, prima ancora +63.7%, +50%, +39%, +36.8%). Si ricordi tuttavia che molti decessi registrati risalgono alle settimane o ai mesi precedenti.",7,,,,,,
Vaccini,https://github.com/Paulsword/PilloleOttimismo/raw/main/Cover8.jpg,219 176,"Il 20/8/2021 sono state 219 176 le somministrazioni di vaccino. Ad oggi in Italia abbiamo eseguito 75 127 479 dosi. Il 69.85% della popolazione ha ricevuto almeno una dose, e il 61.18% della popolazione ha ricevuto vaccinazione completa.",8,,,,,,
