Title,Image,Subtitle,Trend,Color,,,,,,
Aggiornamento,https://github.com/Paulsword/PilloleOttimismo/raw/main/Cover0.jpg,4 agosto 2021,,1,,,,,,
Incidenza,https://github.com/Paulsword/PilloleOttimismo/raw/main/Cover1.jpg,66.2,"L'INCIDENZA su base nazionale è al momento pari a 66.2 nuovi positivi ogni 100.000 abitanti in 7 giorni. Le Regioni con i valori più elevati sono Sardegna, con 131.6 casi, seguono Toscana (118.7), Sicilia (99.2), e Veneto (98.9). L'incidenza più bassa è in Molise, con 21.2 casi.
Nei grafici trovate i valori di incidenza dei Paesi d'Europa, calcolati su 14 giorni.",2,,,,,,
Variazione,https://github.com/Paulsword/PilloleOttimismo/raw/main/Cover2.jpg,+17.5%,"La VARIAZIONE PERCENTUALE dei nuovi casi negli ultimi sette giorni, rispetto ai sette precedenti, è stata pari a +17.5% (ieri era +19.9%, il giorno prima +22.6%, prima ancora +26.6%, +31.8%, +36.7%, +43.3%). I valori più elevati tra le Regioni si riscontrano in Basilicata (+130.6% negli ultimi sette giorni rispetto ai sette precedenti), Valle d'Aosta (+62.9%), Piemonte (+55.5%), Friuli VG (+44.9%), Puglia (+39%), Marche (+38.6%), Toscana (+35.1%), Campania (+35%), Sicilia (+29.2%).",3,,,,,,
Nuovi casi,https://github.com/Paulsword/PilloleOttimismo/raw/main/Cover3.jpg,6596,"Sono 6596 i nuovi positivi registrati oggi, su 215748 tamponi (3.1%) e 53941 persone testate (12.23%).
Negli ultimi sette giorni abbiamo avuto in media 5604 nuovi positivi al giorno, ossia +833 casi al giorno rispetto ai sette giorni precedenti (ieri era +909).",4,,,,,,
Ricoveri,https://github.com/Paulsword/PilloleOttimismo/raw/main/Cover6.jpg,+113,"Abbiamo attualmente 2309 pazienti RICOVERATI IN REPARTO, pari al 4.1% dei posti letto disponibili (fonte: AGENAS). Negli ultimi 7 giorni la variazione media del numero di pazienti ricoverati è stata pari a +89 pazienti al giorno (era +70 nei sette giorni precedenti). La variazione percentuale complessiva sul totale dei pazienti ricoverati in questi sette giorni è stata +37%",5,,,,,,
TI,https://github.com/Paulsword/PilloleOttimismo/raw/main/Cover5.jpg,+2,"Oggi in TERAPIA INTENSIVA saldo di +2 pazienti (14 ingressi e 12 uscite). La variazione del totale degli INGRESSI in TI negli ultimi sette giorni, rispetto ai sette giorni precedenti, è stata del +60% (ieri era +54.7%, il giorno prima +52.2%).
I pazienti in TI sono complessivamente 260, pari al 3% dei posti letto attualmente disponibili. Negli ultimi sette giorni la variazione percentuale complessiva è stata +42.1%",6,,,,,,
Decessi,https://github.com/Paulsword/PilloleOttimismo/raw/main/Cover7.jpg,21,"In media abbiamo registrato in Italia 18 DECESSI al giorno negli ultimi sette giorni, e 15 nei sette giorni precedenti. La variazione dei decessi in questi ultimi sette giorni, rispetto ai sette precedenti, è stata pari a +20% (ieri era +8.1%, il giorno prima +20.6%, prima ancora +41.5%, +55.1%, +27.9%, +36.3%). Si ricordi tuttavia che molti decessi registrati risalgono alle settimane o ai mesi precedenti.",7,,,,,,
Vaccini,https://github.com/Paulsword/PilloleOttimismo/raw/main/Cover8.jpg,423 262,"Il 3/8/2021 sono state 423 262 le somministrazioni di vaccino. Ad oggi in Italia abbiamo eseguito 69 998 328 dosi. Il 65.7% della popolazione ha ricevuto almeno una dose, e il 56.37% della popolazione ha ricevuto vaccinazione completa.",8,,,,,,
